Poster_Link,Series_Title,Released_Year,Certificate,Runtime,Genre,IMDB_Rating,Overview,Meta_score,Director,Star1,Star2,Star3,Star4,No_of_Votes,Gross
"https://m.media-amazon.com/images/M/MV5BMzIwOTdmNjQtOWQ1ZS00ZWQ4LWIxYTMtOWFkM2NjODJiMGY4L2ltYWdlL2ltYWdlXkEyXkFqcGdeQXVyNTI4MjkwNjA@._V1_UX67_CR0,0,67,98_AL_.jpg",la leggenda del pianista sull oceano,1998,u,169 min,drama music romanc,8.1,a babi boy discov in 1900 on an ocean liner grow into a music prodigi never set foot on land,0.0,giusepp tornator,tim roth,pruitt taylor vinc,m lani thierri,bill nunn,0.0,259 127
"https://m.media-amazon.com/images/M/MV5BMDIzODcyY2EtMmY2MC00ZWVlLTgwMzAtMjQwOWUyNmJjNTYyXkEyXkFqcGdeQXVyNDk3NzU2MTQ@._V1_UX67_CR0,0,67,98_AL_.jpg",the truman show,1998,u,103 min,comedi drama,8.1,an insur salesman discov hi whole life is actual a realiti tv show,0.0,peter weir,jim carrey,ed harri,laura linney,noah emmerich,0.0,125 618 201
"https://m.media-amazon.com/images/M/MV5BMmExZTZhN2QtMzg5Mi00Y2M5LTlmMWYtNTUzMzUwMGM2OGQ3XkEyXkFqcGdeQXVyNTA4NzY1MzY@._V1_UX67_CR0,0,67,98_AL_.jpg",crna macka beli macor,1998,r,127 min,comedi crime romanc,8.1,matko and hi son zare live on the bank of the danub river and get by through hustl and basic do anyth to make a live in order to pay off a busi debt matko agre to marri off zare to the sister of a local gangster,0.0,emir kusturica,bajram severdzan,srdjan zika todorov,branka katic,florijan ajdini,0.0,348 660
"https://m.media-amazon.com/images/M/MV5BMTQ0NjUzMDMyOF5BMl5BanBnXkFtZTgwODA1OTU0MDE@._V1_UX67_CR0,0,67,98_AL_.jpg",the big lebowski,1998,r,117 min,comedi crime sport,8.1,jeff the dude lebowski mistaken for a millionair of the same name seek restitut for hi ruin rug and enlist hi bowl buddi to help get it,0.0,joel coen,ethan coen,jeff bridg,john goodman,juliann moor,0.0,17 498 804
"https://m.media-amazon.com/images/M/MV5BYjZjODRlMjQtMjJlYy00ZDBjLTkyYTQtZGQxZTk5NzJhYmNmXkEyXkFqcGdeQXVyMTQxNzMzNDI@._V1_UY98_CR1,0,67,98_AL_.jpg",fa yeung nin wah,2000,u,98 min,drama romanc,8.1,two neighbor a woman and a man form a strong bond after both suspect extramarit activ of their spous howev they agre to keep their bond platon so as not to commit similar wrong,0.0,kar wai wong,toni chiu wai leung,maggi cheung,ping lam siu,tung cho joe cheung,0.0,2 734 044
"https://m.media-amazon.com/images/M/MV5BMzA5Zjc3ZTMtMmU5YS00YTMwLWI4MWUtYTU0YTVmNjVmODZhXkEyXkFqcGdeQXVyNjU0OTQ0OTY@._V1_UX67_CR0,0,67,98_AL_.jpg",trainspot,1996,a,93 min,drama,8.1,renton deepli immers in the edinburgh drug scene tri to clean up and get out despit the allur of the drug and influenc of friend,0.0,danni boyl,ewan mcgregor,ewen bremner,jonni lee miller,kevin mckidd,0.0,16 501 785
"https://m.media-amazon.com/images/M/MV5BNDJiZDgyZjctYmRjMS00ZjdkLTkwMTEtNGU1NDg3NDQ0Yzk1XkEyXkFqcGdeQXVyNzkwMjQ5NzM@._V1_UX67_CR0,0,67,98_AL_.jpg",fargo,1996,a,98 min,crime drama thriller,8.1,jerri lundegaard s inept crime fall apart due to hi and hi henchmen s bungl and the persist polic work of the quit pregnant marg gunderson,0.0,joel coen,ethan coen,william h maci,franc mcdormand,steve buscemi,0.0,24 611 975
"https://m.media-amazon.com/images/M/MV5BNzI4YTVmMWEtMWQ3MS00OGE1LWE5YjMtNjc4NWJmYjRmZTQyXkEyXkFqcGdeQXVyNTA4NzY1MzY@._V1_UY98_CR0,0,67,98_AL_.jpg",underground,1995,Unknown,170 min,comedi drama war,8.1,a group of serbian socialist prepar for the war in a surreal underground fill by parti tragedi love and hate,0.0,emir kusturica,predrag miki manojlov,lazar ristovski,mirjana jokov,slavko stimac,0.0,171 082
"https://m.media-amazon.com/images/M/MV5BNDNiOTA5YjktY2Q0Ni00ODgzLWE5MWItNGExOWRlYjY2MjBlXkEyXkFqcGdeQXVyNjQ2MjQ5NzM@._V1_UY98_CR1,0,67,98_AL_.jpg",la hain,1995,ua,98 min,crime drama,8.1,24 hour in the live of three young men in the french suburb the day after a violent riot,0.0,mathieu kassovitz,vincent cassel,hubert kound,sa d taghmaoui,abdel ahm ghili,0.0,309 811
"https://m.media-amazon.com/images/M/MV5BYmNjYzRlM2YtZTZjZC00ODVmLTljZWMtODg1YmYyNDBiNzU3XkEyXkFqcGdeQXVyNTkzNDQ4ODc@._V1_UY98_CR3,0,67,98_AL_.jpg",dilwal dulhania le jayeng,1995,u,189 min,drama romanc,8.1,when raj meet simran in europ it isn t love at first sight but when simran move to india for an arrang marriag love make it presenc felt,0.0,aditya chopra,shah rukh khan,kajol,amrish puri,farida jalal,0.0,Unknown
"https://m.media-amazon.com/images/M/MV5BZDdiZTAwYzAtMDI3Ni00OTRjLTkzN2UtMGE3MDMyZmU4NTU4XkEyXkFqcGdeQXVyNjU0OTQ0OTY@._V1_UX67_CR0,0,67,98_AL_.jpg",befor sunris,1995,r,101 min,drama romanc,8.1,a young man and woman meet on a train in europ and wind up spend one even togeth in vienna unfortun both know that thi will probabl be their onli night togeth,0.0,richard linklat,ethan hawk,juli delpi,andrea eckert,hanno p schl,0.0,5 535 405
"https://m.media-amazon.com/images/M/MV5BYTg1MmNiMjItMmY4Yy00ZDQ3LThjMzYtZGQ0ZTQzNTdkMGQ1L2ltYWdlL2ltYWdlXkEyXkFqcGdeQXVyMTQxNzMzNDI@._V1_UX67_CR0,0,67,98_AL_.jpg",troi couleur roug,1994,u,99 min,drama mysteri romanc,8.1,a model discov a retir judg is keen on invad peopl s privaci,0.0,krzysztof kieslowski,ir ne jacob,jean loui trintign,fr d riqu feder,jean pierr lorit,0.0,4 043 686
"https://m.media-amazon.com/images/M/MV5BMGQ5MzljNzYtMDM1My00NmI0LThlYzQtMTg0ZmQ0MTk1YjkxXkEyXkFqcGdeQXVyNTAyODkwOQ@@._V1_UY98_CR1,0,67,98_AL_.jpg",chung hing sam lam,1994,u,102 min,comedi crime drama,8.1,two melancholi hong kong policemen fall in love one with a mysteri femal underworld figur the other with a beauti and ether server at a late night restaur he frequent,0.0,kar wai wong,brigitt lin,takeshi kaneshiro,toni chiu wai leung,fay wong,0.0,600 200
"https://m.media-amazon.com/images/M/MV5BMjM2MDgxMDg0Nl5BMl5BanBnXkFtZTgwNTM2OTM5NDE@._V1_UX67_CR0,0,67,98_AL_.jpg",jurass park,1993,ua,127 min,action adventur sci fi,8.1,a pragmat paleontologist visit an almost complet theme park is task with protect a coupl of kid after a power failur caus the park s clone dinosaur to run loos,0.0,steven spielberg,sam neill,laura dern,jeff goldblum,richard attenborough,0.0,402 453 882
"https://m.media-amazon.com/images/M/MV5BMmYyOTgwYWItYmU3Ny00M2E2LTk0NWMtMDVlNmQ0MWZiMTMxXkEyXkFqcGdeQXVyNzkwMjQ5NzM@._V1_UX67_CR0,0,67,98_AL_.jpg",in the name of the father,1993,ua,133 min,biographi crime drama,8.1,a man s coerc confess to an i r a bomb he did not commit result in the imprison of hi father as well an english lawyer fight to free them,0.0,jim sheridan,daniel day lewi,pete postlethwait,alison crosbi,philip king,0.0,25 010 410
"https://m.media-amazon.com/images/M/MV5BYmFhZmM3Y2MtNDA1Ny00NjkzLWJkM2EtYWU1ZjEwYmNjZDQ0XkEyXkFqcGdeQXVyMTMxMTY0OTQ@._V1_UX67_CR0,0,67,98_AL_.jpg",ba wang bie ji,1993,r,171 min,drama music romanc,8.1,two boy meet at an opera train school in peke in 1924 their result friendship will span nearli 70 year and will endur some of the most troublesom time in china s histori,0.0,kaig chen,lesli cheung,fengyi zhang,gong li,you ge,0.0,5 216 888
"https://m.media-amazon.com/images/M/MV5BMjEzNjY5NDcwNV5BMl5BanBnXkFtZTcwNzEwMzg4NA@@._V1_UX67_CR0,0,67,98_AL_.jpg",d h ng denglong gaogao gu,1991,pg,125 min,drama histori romanc,8.1,a young woman becom the fourth wife of a wealthi lord and must learn to live with the strict rule and tension within the household,0.0,yimou zhang,gong li,jingwu ma,saifei he,cuifen cao,0.0,2 603 061
"https://m.media-amazon.com/images/M/MV5BOGYwYWNjMzgtNGU4ZC00NWQ2LWEwZjUtMzE1Zjc3NjY3YTU1XkEyXkFqcGdeQXVyMTQxNzMzNDI@._V1_UX67_CR0,0,67,98_AL_.jpg",dead poet societi,1989,u,128 min,comedi drama,8.1,maverick teacher john keat use poetri to embolden hi board school student to new height of self express,0.0,peter weir,robin william,robert sean leonard,ethan hawk,josh charl,0.0,95 860 116
"https://m.media-amazon.com/images/M/MV5BODJmY2Y2OGQtMDg2My00N2Q3LWJmZTUtYTc2ODBjZDVlNDlhXkEyXkFqcGdeQXVyMTQxNzMzNDI@._V1_UX67_CR0,0,67,98_AL_.jpg",stand by me,1986,u,89 min,adventur drama,8.1,after the death of one of hi friend a writer recount a childhood journey with hi friend to find the bodi of a miss boy,0.0,rob reiner,wil wheaton,river phoenix,corey feldman,jerri o connel,0.0,52 287 414
"https://m.media-amazon.com/images/M/MV5BMzRjZjdlMjQtODVkYS00N2YzLWJlYWYtMGVlN2E5MWEwMWQzXkEyXkFqcGdeQXVyMTQxNzMzNDI@._V1_UX67_CR0,0,67,98_AL_.jpg",platoon,1986,a,120 min,drama war,8.1,chri taylor a neophyt recruit in vietnam find himself caught in a battl of will between two sergeant one good and the other evil a shrewd examin of the brutal of war and the dualiti of man in conflict,0.0,oliv stone,charli sheen,tom bereng,willem dafo,keith david,0.0,138 530 565
"https://m.media-amazon.com/images/M/MV5BM2RjMmU3ZWItYzBlMy00ZmJkLWE5YzgtNTVkODdhOWM3NGZhXkEyXkFqcGdeQXVyNDA5Mjg5MjA@._V1_UX67_CR0,0,67,98_AL_.jpg",pari texa,1984,u,145 min,drama,8.1,travi henderson an aimless drifter who ha been miss for four year wander out of the desert and must reconnect with societi himself hi life and hi famili,0.0,wim wender,harri dean stanton,nastassja kinski,dean stockwel,auror cl ment,0.0,2 181 987
"https://m.media-amazon.com/images/M/MV5BZWFkN2ZhODAtYTNkZS00Y2NjLWIzNDYtNzJjNDNlMzAyNTIyXkEyXkFqcGdeQXVyODEzNjM5OTQ@._V1_UY98_CR1,0,67,98_AL_.jpg",kaze no tani no naushika,1984,u,117 min,anim adventur fantasi,8.1,warrior and pacifist princess nausica desper struggl to prevent two war nation from destroy themselv and their die planet,0.0,hayao miyazaki,sumi shimamoto,mahito tsujimura,hisako ky da,gor naya,0.0,495 770
"https://m.media-amazon.com/images/M/MV5BNGViZWZmM2EtNGYzZi00ZDAyLTk3ODMtNzIyZTBjN2Y1NmM1XkEyXkFqcGdeQXVyNTAyODkwOQ@@._V1_UX67_CR0,0,67,98_AL_.jpg",the thing,1982,a,109 min,horror mysteri sci fi,8.1,a research team in antarctica is hunt by a shape shift alien that assum the appear of it victim,0.0,john carpent,kurt russel,wilford brimley,keith david,richard masur,0.0,13 782 838
"https://m.media-amazon.com/images/M/MV5BZDhlZTYxOTYtYTk3Ny00ZDljLTk3ZmItZTcxZWU5YTIyYmFkXkEyXkFqcGdeQXVyMTQxNzMzNDI@._V1_UX67_CR0,0,67,98_AL_.jpg",pink floyd the wall,1982,ua,95 min,drama fantasi music,8.1,a confin but troubl rock star descend into mad in the midst of hi physic and social isol from everyon,0.0,alan parker,bob geldof,christin hargreav,jame laurenson,eleanor david,0.0,22 244 207
"https://m.media-amazon.com/images/M/MV5BYjIzNTYxMTctZjAwNS00YzI3LWExMGMtMGQxNGM5ZTc1NzhlXkEyXkFqcGdeQXVyMTQxNzMzNDI@._V1_UX67_CR0,0,67,98_AL_.jpg",fitzcarraldo,1982,r,158 min,adventur drama,8.1,the stori of brian sweeney fitzgerald an extrem determin man who intend to build an opera hous in the middl of a jungl,0.0,werner herzog,klau kinski,claudia cardinal,jo lewgoy,miguel ngel fuent,0.0,Unknown
"https://m.media-amazon.com/images/M/MV5BZmQzMDE5ZWQtOTU3ZS00ZjdhLWI0OTctZDNkODk4YThmOTRhL2ltYWdlXkEyXkFqcGdeQXVyNjc1NTYyMjg@._V1_UX67_CR0,0,67,98_AL_.jpg",fanni och alexand,1982,a,188 min,drama,8.1,two young swedish children experi the mani comedi and tragedi of their famili the ekdahl,0.0,ingmar bergman,bertil guve,pernilla allwin,kristina adolphson,b rje ahlstedt,0.0,4 971 340
"https://m.media-amazon.com/images/M/MV5BNzQzMzJhZTEtOWM4NS00MTdhLTg0YjgtMjM4MDRkZjUwZDBlXkEyXkFqcGdeQXVyNjU0OTQ0OTY@._V1_UX67_CR0,0,67,98_AL_.jpg",blade runner,1982,ua,117 min,action sci fi thriller,8.1,a blade runner must pursu and termin four replic who stole a ship in space and have return to earth to find their creator,0.0,ridley scott,harrison ford,rutger hauer,sean young,edward jame olmo,0.0,32 868 943
"https://m.media-amazon.com/images/M/MV5BMDVjNjIwOGItNDE3Ny00OThjLWE0NzQtZTU3YjMzZTZjMzhkXkEyXkFqcGdeQXVyMTQxNzMzNDI@._V1_UX67_CR0,0,67,98_AL_.jpg",the eleph man,1980,ua,124 min,biographi drama,8.1,a victorian surgeon rescu a heavili disfigur man who is mistreat while scrape a live as a side show freak behind hi monstrou fa ade there is reveal a person of kind intellig and sophist,0.0,david lynch,anthoni hopkin,john hurt,ann bancroft,john gielgud,0.0,Unknown
"https://m.media-amazon.com/images/M/MV5BMzAwNjU1OTktYjY3Mi00NDY5LWFlZWUtZjhjNGE0OTkwZDkwXkEyXkFqcGdeQXVyMTQxNzMzNDI@._V1_UX67_CR0,0,67,98_AL_.jpg",life of brian,1979,r,94 min,comedi,8.1,born on the origin christma in the stabl next door to jesu christ brian of nazareth spend hi life be mistaken for a messiah,0.0,terri jone,graham chapman,john clees,michael palin,terri gilliam,0.0,20 045 115
"https://m.media-amazon.com/images/M/MV5BNDhmNTA0ZDMtYjhkNS00NzEzLWIzYTItOGNkMTVmYjE2YmI3XkEyXkFqcGdeQXVyNzkwMjQ5NzM@._V1_UX67_CR0,0,67,98_AL_.jpg",the deer hunter,1978,a,183 min,drama war,8.1,an in depth examin of the way in which the u s vietnam war impact and disrupt the live of peopl in a small industri town in pennsylvania,0.0,michael cimino,robert de niro,christoph walken,john cazal,john savag,0.0,48 979 328
"https://m.media-amazon.com/images/M/MV5BMTY5MDMzODUyOF5BMl5BanBnXkFtZTcwMTQ3NTMyNA@@._V1_UX67_CR0,0,67,98_AL_.jpg",rocki,1976,u,120 min,drama sport,8.1,a small time boxer get a suprem rare chanc to fight a heavi weight champion in a bout in which he strive to go the distanc for hi self respect,0.0,john g avildsen,sylvest stallon,talia shire,burt young,carl weather,0.0,117 235 247
"https://m.media-amazon.com/images/M/MV5BZGNjYjM2MzItZGQzZi00NmY3LTgxOGUtMTQ2MWQxNWQ2MmMwXkEyXkFqcGdeQXVyNzM0MTUwNTY@._V1_UX67_CR0,0,67,98_AL_.jpg",network,1976,ua,121 min,drama,8.1,a televis network cynic exploit a derang former anchor s rave and revel about the news media for it own profit,0.0,sidney lumet,fay dunaway,william holden,peter finch,robert duval,0.0,Unknown
"https://m.media-amazon.com/images/M/MV5BNmY0MWY2NDctZDdmMi00MjA1LTk0ZTQtZDMyZTQ1NTNlYzVjXkEyXkFqcGdeQXVyMjUzOTY1NTc@._V1_UX67_CR0,0,67,98_AL_.jpg",barri lyndon,1975,pg,185 min,adventur drama histori,8.1,an irish rogu win the heart of a rich widow and assum her dead husband s aristocrat posit in 18th centuri england,0.0,stanley kubrick,ryan o neal,marisa berenson,patrick mage,hardi kr ger,0.0,Unknown
"https://m.media-amazon.com/images/M/MV5BMTg1MDg3OTk3M15BMl5BanBnXkFtZTgwMDEzMzE5MTE@._V1_UY98_CR0,0,67,98_AL_.jpg",zerkalo,1975,g,107 min,biographi drama,8.1,a die man in hi forti rememb hi past hi childhood hi mother the war person moment and thing that tell of the recent histori of all the russian nation,0.0,andrei tarkovski,margarita terekhova,filipp yankovskiy,ignat daniltsev,oleg yankovskiy,0.0,177 345
"https://m.media-amazon.com/images/M/MV5BOGMwYmY5ZmEtMzY1Yi00OWJiLTk1Y2MtMzI2MjBhYmZkNTQ0XkEyXkFqcGdeQXVyNzkwMjQ5NzM@._V1_UX67_CR0,0,67,98_AL_.jpg",chinatown,1974,ua,130 min,drama mysteri thriller,8.1,a privat detect hire to expos an adulter find himself caught up in a web of deceit corrupt and murder,0.0,roman polanski,jack nicholson,fay dunaway,john huston,perri lopez,0.0,29 000 000
"https://m.media-amazon.com/images/M/MV5BOWVmYzQwY2MtOTBjNi00MDNhLWI5OGMtN2RiMDYxODI3MjU5XkEyXkFqcGdeQXVyMjUzOTY1NTc@._V1_UX67_CR0,0,67,98_AL_.jpg",paper moon,1973,u,102 min,comedi crime drama,8.1,dure the great depress a con man find himself saddl with a young girl who may or may not be hi daughter and the two forg an unlik partnership,0.0,peter bogdanovich,ryan o neal,tatum o neal,madelin kahn,john hillerman,0.0,30 933 743
"https://m.media-amazon.com/images/M/MV5BMTg3NzYzOTEtNmE2Ni00M2EyLWJhMjctNjMyMTk4ZTViOGUzXkEyXkFqcGdeQXVyNzQxNDExNTU@._V1_UY98_CR0,0,67,98_AL_.jpg",viskningar och rop,1972,a,91 min,drama,8.1,when a woman die of cancer in earli twentieth centuri sweden is visit by her two sister long repress feel between the sibl rise to the surfac,0.0,ingmar bergman,harriet andersson,liv ullmann,kari sylwan,ingrid thulin,0.0,1 742 348
"https://m.media-amazon.com/images/M/MV5BZmY4Yjc0OWQtZDRhMy00ODc2LWI2NGYtMWFlODYyN2VlNDQyXkEyXkFqcGdeQXVyNjU0OTQ0OTY@._V1_UY98_CR1,0,67,98_AL_.jpg",solari,1972,pg,167 min,drama mysteri sci fi,8.1,a psychologist is sent to a station orbit a distant planet in order to discov what ha caus the crew to go insan,0.0,andrei tarkovski,natalya bondarchuk,donata banioni,j ri j rvet,vladislav dvorzhetskiy,0.0,Unknown
"https://m.media-amazon.com/images/M/MV5BMWFjZjRiM2QtZmRkOC00MDUxLTlhYmQtYmY5ZTNiMTI5Nzc2L2ltYWdlXkEyXkFqcGdeQXVyNTAyODkwOQ@@._V1_UX67_CR0,0,67,98_AL_.jpg",le samoura,1967,gp,105 min,crime drama mysteri,8.1,after profession hitman jef costello is seen by wit hi effort to provid himself an alibi drive him further into a corner,0.0,jean pierr melvil,alain delon,fran oi p rier,nathali delon,cathi rosier,0.0,39 481
"https://m.media-amazon.com/images/M/MV5BOWFlNzZhYmYtYTI5YS00MDQyLWIyNTUtNTRjMWUwNTEzNjA0XkEyXkFqcGdeQXVyNjUwNzk3NDc@._V1_UX67_CR0,0,67,98_AL_.jpg",cool hand luke,1967,a,127 min,crime drama,8.1,a laid back southern man is sentenc to two year in a rural prison but refus to conform,0.0,stuart rosenberg,paul newman,georg kennedi,strother martin,j d cannon,0.0,16 217 773
"https://m.media-amazon.com/images/M/MV5BMTM0YzExY2EtMjUyZi00ZmIwLWFkYTktNjY5NmVkYTdkMjI5XkEyXkFqcGdeQXVyNzQxNDExNTU@._V1_UY98_CR0,0,67,98_AL_.jpg",persona,1966,Unknown,85 min,drama thriller,8.1,a nurs is put in charg of a mute actress and find that their persona are meld togeth,0.0,ingmar bergman,bibi andersson,liv ullmann,margaretha krook,gunnar bj rnstrand,0.0,Unknown
"https://m.media-amazon.com/images/M/MV5BNjM2MjMwNzUzN15BMl5BanBnXkFtZTgwMjEzMzE5MTE@._V1_UY98_CR2,0,67,98_AL_.jpg",andrei rublev,1966,r,205 min,biographi drama histori,8.1,the life time and afflict of the fifteenth centuri russian iconograph st andrei rublev,0.0,andrei tarkovski,anatoliy solonitsyn,ivan lapikov,nikolay grinko,nikolay sergeev,0.0,102 021
"https://m.media-amazon.com/images/M/MV5BZWEzMGY4OTQtYTdmMy00M2QwLTliYTQtYWUzYzc3OTA5YzIwXkEyXkFqcGdeQXVyNjc1NTYyMjg@._V1_UY98_CR1,0,67,98_AL_.jpg",la battaglia di algeri,1966,Unknown,121 min,drama war,8.1,in the 1950 fear and violenc escal as the peopl of algier fight for independ from the french govern,0.0,gillo pontecorvo,brahim hadjadj,jean martin,yacef saadi,samia kerbash,0.0,55 908
"https://m.media-amazon.com/images/M/MV5BZTg3M2ExY2EtZmI5Yy00YWM1LTg4NzItZWEzZTgxNzE2MjhhXkEyXkFqcGdeQXVyNDE5MTU2MDE@._V1_UX67_CR0,0,67,98_AL_.jpg",el ngel exterminador,1962,Unknown,95 min,drama fantasi,8.1,the guest at an upper class dinner parti find themselv unabl to leav,0.0,lui bu uel,silvia pinal,jacquelin ander,enriqu rambal,jo baviera,0.0,Unknown
"https://m.media-amazon.com/images/M/MV5BZmI0M2VmNTgtMWVhYS00Zjg1LTk1YTYtNmJmMjRkZmMwYTc2XkEyXkFqcGdeQXVyNTA4NzY1MzY@._V1_UX67_CR0,0,67,98_AL_.jpg",what ever happen to babi jane,1962,pass,134 min,drama horror thriller,8.1,a former child star torment her parapleg sister in their decay hollywood mansion,0.0,robert aldrich,bett davi,joan crawford,victor buono,wesley addi,0.0,4 050 000
"https://m.media-amazon.com/images/M/MV5BZmY3MDlmODctYTY3Yi00NzYyLWIxNTUtYjVlZWZjMmMwZTBkXkEyXkFqcGdeQXVyMzAxNjg3MjQ@._V1_UX67_CR0,0,67,98_AL_.jpg",sanjuro,1962,u,96 min,action comedi crime,8.1,a crafti samurai help a young man and hi fellow clansmen save hi uncl who ha been frame and imprison by a corrupt superintend,0.0,akira kurosawa,toshir mifun,tatsuya nakadai,keiju kobayashi,y nosuk it,0.0,Unknown
"https://m.media-amazon.com/images/M/MV5BMGEyNzhkYzktMGMyZS00YzRiLWJlYjktZjJkOTU5ZDY0ZGI4XkEyXkFqcGdeQXVyNjUwNzk3NDc@._V1_UX67_CR0,0,67,98_AL_.jpg",the man who shot liberti valanc,1962,Unknown,123 min,drama western,8.1,a senat return to a western town for the funer of an old friend and tell the stori of hi origin,0.0,john ford,jame stewart,john wayn,vera mile,lee marvin,0.0,Unknown
"https://m.media-amazon.com/images/M/MV5BYTYzYzBhYjQtNDQxYS00MmUwLTkyZjgtZWVkOWFjNzE5OTI2XkEyXkFqcGdeQXVyNjMxMjkwMjI@._V1_UX67_CR0,0,67,98_AL_.jpg",ivanovo detstvo,1962,Unknown,95 min,drama war,8.1,in ww2 twelv year old soviet orphan ivan bondarev work for the soviet armi as a scout behind the german line and strike a friendship with three sympathet soviet offic,0.0,andrei tarkovski,eduard abalov,nikolay burlyaev,valentin zubkov,evgeniy zharikov,0.0,Unknown
"https://m.media-amazon.com/images/M/MV5BZjgyMzZkMGUtNTBhZC00OTkzLWI4ZmMtYzcwMzc5MjQ0YTM3XkEyXkFqcGdeQXVyMTMxMTY0OTQ@._V1_UY98_CR3,0,67,98_AL_.jpg",jungfruk llan,1960,a,89 min,drama,8.1,an innoc yet pamper young virgin and her famili s pregnant and jealou servant set out to deliv candl to church but onli one return from event that transpir in the wood along the way,0.0,ingmar bergman,max von sydow,birgitta valberg,gunnel lindblom,birgitta pettersson,0.0,1 526 000
"https://m.media-amazon.com/images/M/MV5BMGQ5ODNkNWYtYTgxZS00YjJkLThhODAtYzUwNGNiYjRmNjdkXkEyXkFqcGdeQXVyMTg2NTc4MzA@._V1_UY98_CR4,0,67,98_AL_.jpg",inherit the wind,1960,pass,128 min,biographi drama histori,8.1,base on a real life case in 1925 two great lawyer argu the case for and against a scienc teacher accus of the crime of teach evolut,0.0,stanley kramer,spencer traci,fredric march,gene kelli,dick york,0.0,Unknown
"https://m.media-amazon.com/images/M/MV5BYTQ4MjA4NmYtYjRhNi00MTEwLTg0NjgtNjk3ODJlZGU4NjRkL2ltYWdlL2ltYWdlXkEyXkFqcGdeQXVyNjU0OTQ0OTY@._V1_UY98_CR3,0,67,98_AL_.jpg",le quatr cent coup,1959,Unknown,99 min,crime drama,8.1,a young boy left without attent delv into a life of petti crime,0.0,fran oi truffaut,jean pierr l aud,albert r my,clair maurier,guy decombl,0.0,Unknown
"https://m.media-amazon.com/images/M/MV5BNjgxY2JiZDYtZmMwOC00ZmJjLWJmODUtMTNmNWNmYWI5ODkwL2ltYWdlL2ltYWdlXkEyXkFqcGdeQXVyNjc1NTYyMjg@._V1_UX67_CR0,0,67,98_AL_.jpg",ben hur,1959,u,212 min,adventur drama histori,8.1,after a jewish princ is betray and sent into slaveri by a roman friend he regain hi freedom and come back for reveng,0.0,william wyler,charlton heston,jack hawkin,stephen boyd,haya harareet,0.0,74 700 000
"https://m.media-amazon.com/images/M/MV5BYjJkN2Y5MTktZDRhOS00NTUwLWFiMzEtMTVlNWU4ODM0Y2E5XkEyXkFqcGdeQXVyNjc1NTYyMjg@._V1_UY98_CR1,0,67,98_AL_.jpg",kakushi torid no san akunin,1958,Unknown,139 min,adventur drama,8.1,lure by gold two greedi peasant unknowingli escort a princess and her gener across enemi line,0.0,akira kurosawa,toshir mifun,misa uehara,minoru chiaki,kamatari fujiwara,0.0,Unknown
"https://m.media-amazon.com/images/M/MV5BOTdhNmUxZmQtNmMwNC00MzE3LWE1MTUtZDgxZTYwYjEzZjcwXkEyXkFqcGdeQXVyNTA1NjYyMDk@._V1_UY98_CR0,0,67,98_AL_.jpg",le notti di cabiria,1957,Unknown,110 min,drama,8.1,a waifish prostitut wander the street of rome look for true love but find onli heartbreak,0.0,federico fellini,giulietta masina,fran oi p rier,franca marzi,dorian gray,0.0,752 045
"https://m.media-amazon.com/images/M/MV5BNGYxZjA2M2ItYTRmNS00NzRmLWJkYzgtYTdiNGFlZDI5ZjNmXkEyXkFqcGdeQXVyNDE5MTU2MDE@._V1_UY98_CR0,0,67,98_AL_.jpg",kumonosu j,1957,Unknown,110 min,drama histori,8.1,a war harden gener eg on by hi ambiti wife work to fulfil a propheci that he would becom lord of spider s web castl,0.0,akira kurosawa,toshir mifun,minoru chiaki,isuzu yamada,takashi shimura,0.0,Unknown
"https://m.media-amazon.com/images/M/MV5BMGVhNjhjODktODgxYS00MDdhLTlkZjktYTkyNzQxMTU0ZDYxXkEyXkFqcGdeQXVyNzkwMjQ5NzM@._V1_UX67_CR0,0,67,98_AL_.jpg",the bridg on the river kwai,1957,pg,161 min,adventur drama war,8.1,british pow are forc to build a railway bridg across the river kwai for their japanes captor not know that the alli forc are plan to destroy it,0.0,david lean,william holden,alec guin,jack hawkin,sessu hayakawa,0.0,44 908 000
"https://m.media-amazon.com/images/M/MV5BY2I0MWFiZDMtNWQyYy00Njk5LTk3MDktZjZjNTNmZmVkYjkxXkEyXkFqcGdeQXVyNjc1NTYyMjg@._V1_UX67_CR0,0,67,98_AL_.jpg",on the waterfront,1954,a,108 min,crime drama thriller,8.1,an ex prize fighter turn longshoreman struggl to stand up to hi corrupt union boss,0.0,elia kazan,marlon brando,karl malden,lee j cobb,rod steiger,0.0,9 600 000
"https://m.media-amazon.com/images/M/MV5BZDdkNzMwZmUtY2Q5MS00ZmM2LWJhYjItYTBjMWY0MGM4MDRjXkEyXkFqcGdeQXVyNTA4NzY1MzY@._V1_UY98_CR0,0,67,98_AL_.jpg",le salair de la peur,1953,u,131 min,adventur drama thriller,8.1,in a decrepit south american villag four men are hire to transport an urgent nitroglycerin shipment without the equip that would make it safe,0.0,henri georg clouzot,yve montand,charl vanel,peter van eyck,folco lulli,0.0,Unknown
"https://m.media-amazon.com/images/M/MV5BNDUzZjlhZTYtN2E5MS00ODQ3LWI1ZjgtNzdiZmI0NTZiZTljXkEyXkFqcGdeQXVyMjI4MjA5MzA@._V1_UX67_CR0,0,67,98_AL_.jpg",ace in the hole,1951,approv,111 min,drama film noir,8.1,a frustrat former big citi journalist now stuck work for an albuquerqu newspap exploit a stori about a man trap in a cave to rekindl hi career but the situat quickli escal into an out of control circu,0.0,billi wilder,kirk dougla,jan sterl,robert arthur,porter hall,0.0,3 969 893
"https://m.media-amazon.com/images/M/MV5BZmI5NTA3MjItYzdhMi00MWMxLTg3OWMtYWQyYjg5MTFmM2U0L2ltYWdlL2ltYWdlXkEyXkFqcGdeQXVyNjc1NTYyMjg@._V1_UX67_CR0,0,67,98_AL_.jpg",white heat,1949,Unknown,114 min,action crime drama,8.1,a psychopath crimin with a mother complex make a dare break from prison and lead hi old gang in a chemic plant payrol heist,0.0,raoul walsh,jame cagney,virginia mayo,edmond o brien,margaret wycherli,0.0,Unknown
"https://m.media-amazon.com/images/M/MV5BYjE2OTdhMWUtOGJlMy00ZDViLWIzZjgtYjZkZGZmMDZjYmEyXkEyXkFqcGdeQXVyNzkwMjQ5NzM@._V1_UX67_CR0,0,67,98_AL_.jpg",the third man,1949,approv,104 min,film noir mysteri thriller,8.1,pulp novelist holli martin travel to shadowi postwar vienna onli to find himself investig the mysteri death of an old friend harri lime,0.0,carol reed,orson well,joseph cotten,alida valli,trevor howard,0.0,449 191
"https://m.media-amazon.com/images/M/MV5BOWRmNGEwZjUtZjEwNS00OGZmLThhMmEtZTJlMTU5MGQ3ZWUwXkEyXkFqcGdeQXVyNjc1NTYyMjg@._V1_UX67_CR0,0,67,98_AL_.jpg",the red shoe,1948,Unknown,135 min,drama music romanc,8.1,a young ballet dancer is torn between the man she love and her pursuit to becom a prima ballerina,0.0,michael powel,emer pressburg,anton walbrook,mariu gore,moira shearer,0.0,10 900 000
