Poster_Link,Series_Title,Released_Year,Certificate,Runtime,Genre,IMDB_Rating,Overview,Meta_score,Director,Star1,Star2,Star3,Star4,No_of_Votes,Gross
"https://m.media-amazon.com/images/M/MV5BMDFkYTc0MGEtZmNhMC00ZDIzLWFmNTEtODM1ZmRlYWMwMWFmXkEyXkFqcGdeQXVyMTMxODk2OTU@._V1_UX67_CR0,0,67,98_AL_.jpg",the shawshank redempt,1994,a,142 min,drama,9.3,two imprison men bond over a number of year find solac and eventu redempt through act of common decenc,0.0,frank darabont,tim robbin,morgan freeman,bob gunton,william sadler,0.0,28 341 469
"https://m.media-amazon.com/images/M/MV5BM2MyNjYxNmUtYTAwNi00MTYxLWJmNWYtYzZlODY3ZTk3OTFlXkEyXkFqcGdeQXVyNzkwMjQ5NzM@._V1_UY98_CR1,0,67,98_AL_.jpg",the godfath,1972,a,175 min,crime drama,9.2,an organ crime dynasti s age patriarch transfer control of hi clandestin empir to hi reluct son,0.0,franci ford coppola,marlon brando,al pacino,jame caan,dian keaton,0.0,134 966 411
"https://m.media-amazon.com/images/M/MV5BMTMxNTMwODM0NF5BMl5BanBnXkFtZTcwODAyMTk2Mw@@._V1_UX67_CR0,0,67,98_AL_.jpg",the dark knight,2008,ua,152 min,action crime drama,9.0,when the menac known as the joker wreak havoc and chao on the peopl of gotham batman must accept one of the greatest psycholog and physic test of hi abil to fight injustic,0.0,christoph nolan,christian bale,heath ledger,aaron eckhart,michael cain,0.0,534 858 444
"https://m.media-amazon.com/images/M/MV5BMWMwMGQzZTItY2JlNC00OWZiLWIyMDctNDk2ZDQ2YjRjMWQ0XkEyXkFqcGdeQXVyNzkwMjQ5NzM@._V1_UY98_CR1,0,67,98_AL_.jpg",the godfath part ii,1974,a,202 min,crime drama,9.0,the earli life and career of vito corleon in 1920 new york citi is portray while hi son michael expand and tighten hi grip on the famili crime syndic,0.0,franci ford coppola,al pacino,robert de niro,robert duval,dian keaton,0.0,57 300 000
"https://m.media-amazon.com/images/M/MV5BMWU4N2FjNzYtNTVkNC00NzQ0LTg0MjAtYTJlMjFhNGUxZDFmXkEyXkFqcGdeQXVyNjc1NTYyMjg@._V1_UX67_CR0,0,67,98_AL_.jpg",12 angri men,1957,u,96 min,crime drama,9.0,a juri holdout attempt to prevent a miscarriag of justic by forc hi colleagu to reconsid the evid,0.0,sidney lumet,henri fonda,lee j cobb,martin balsam,john fiedler,0.0,4 360 000
"https://m.media-amazon.com/images/M/MV5BNzA5ZDNlZWMtM2NhNS00NDJjLTk4NDItYTRmY2EwMWZlMTY3XkEyXkFqcGdeQXVyNzkwMjQ5NzM@._V1_UX67_CR0,0,67,98_AL_.jpg",the lord of the ring the return of the king,2003,u,201 min,action adventur drama,8.9,gandalf and aragorn lead the world of men against sauron s armi to draw hi gaze from frodo and sam as they approach mount doom with the one ring,0.0,peter jackson,elijah wood,viggo mortensen,ian mckellen,orlando bloom,0.0,377 845 905
"https://m.media-amazon.com/images/M/MV5BNGNhMDIzZTUtNTBlZi00MTRlLWFjM2ItYzViMjE3YzI5MjljXkEyXkFqcGdeQXVyNzkwMjQ5NzM@._V1_UY98_CR0,0,67,98_AL_.jpg",pulp fiction,1994,a,154 min,crime drama,8.9,the live of two mob hitmen a boxer a gangster and hi wife and a pair of diner bandit intertwin in four tale of violenc and redempt,0.0,quentin tarantino,john travolta,uma thurman,samuel l jackson,bruce willi,0.0,107 928 762
"https://m.media-amazon.com/images/M/MV5BNDE4OTMxMTctNmRhYy00NWE2LTg3YzItYTk3M2UwOTU5Njg4XkEyXkFqcGdeQXVyNjU0OTQ0OTY@._V1_UX67_CR0,0,67,98_AL_.jpg",schindler s list,1993,a,195 min,biographi drama histori,8.9,in german occupi poland dure world war ii industrialist oskar schindler gradual becom concern for hi jewish workforc after wit their persecut by the nazi,0.0,steven spielberg,liam neeson,ralph fienn,ben kingsley,carolin goodal,0.0,96 898 818
"https://m.media-amazon.com/images/M/MV5BMjAxMzY3NjcxNF5BMl5BanBnXkFtZTcwNTI5OTM0Mw@@._V1_UX67_CR0,0,67,98_AL_.jpg",incept,2010,ua,148 min,action adventur sci fi,8.8,a thief who steal corpor secret through the use of dream share technolog is given the invers task of plant an idea into the mind of a c e o,0.0,christoph nolan,leonardo dicaprio,joseph gordon levitt,elliot page,ken watanab,0.0,292 576 195
"https://m.media-amazon.com/images/M/MV5BMmEzNTkxYjQtZTc0MC00YTVjLTg5ZTEtZWMwOWVlYzY0NWIwXkEyXkFqcGdeQXVyNzkwMjQ5NzM@._V1_UX67_CR0,0,67,98_AL_.jpg",fight club,1999,a,139 min,drama,8.8,an insomniac offic worker and a devil may care soapmak form an underground fight club that evolv into someth much much more,0.0,david fincher,brad pitt,edward norton,meat loaf,zach grenier,0.0,37 030 102
"https://m.media-amazon.com/images/M/MV5BN2EyZjM3NzUtNWUzMi00MTgxLWI0NTctMzY4M2VlOTdjZWRiXkEyXkFqcGdeQXVyNDUzOTQ5MjY@._V1_UX67_CR0,0,67,98_AL_.jpg",the lord of the ring the fellowship of the ring,2001,u,178 min,action adventur drama,8.8,a meek hobbit from the shire and eight companion set out on a journey to destroy the power one ring and save middl earth from the dark lord sauron,0.0,peter jackson,elijah wood,ian mckellen,orlando bloom,sean bean,0.0,315 544 750
"https://m.media-amazon.com/images/M/MV5BNWIwODRlZTUtY2U3ZS00Yzg1LWJhNzYtMmZiYmEyNmU1NjMzXkEyXkFqcGdeQXVyMTQxNzMzNDI@._V1_UY98_CR0,0,67,98_AL_.jpg",forrest gump,1994,ua,142 min,drama romanc,8.8,the presid of kennedi and johnson the event of vietnam waterg and other histor event unfold through the perspect of an alabama man with an iq of 75 whose onli desir is to be reunit with hi childhood sweetheart,0.0,robert zemecki,tom hank,robin wright,gari sinis,salli field,0.0,330 252 182
"https://m.media-amazon.com/images/M/MV5BOTQ5NDI3MTI4MF5BMl5BanBnXkFtZTgwNDQ4ODE5MDE@._V1_UX67_CR0,0,67,98_AL_.jpg",il buono il brutto il cattivo,1966,a,161 min,western,8.8,a bounti hunt scam join two men in an uneasi allianc against a third in a race to find a fortun in gold buri in a remot cemeteri,0.0,sergio leon,clint eastwood,eli wallach,lee van cleef,aldo giuffr,0.0,6 100 000
"https://m.media-amazon.com/images/M/MV5BZGMxZTdjZmYtMmE2Ni00ZTdkLWI5NTgtNjlmMjBiNzU2MmI5XkEyXkFqcGdeQXVyNjU0OTQ0OTY@._V1_UX67_CR0,0,67,98_AL_.jpg",the lord of the ring the two tower,2002,ua,179 min,action adventur drama,8.7,while frodo and sam edg closer to mordor with the help of the shifti gollum the divid fellowship make a stand against sauron s new alli saruman and hi hord of isengard,0.0,peter jackson,elijah wood,ian mckellen,viggo mortensen,orlando bloom,0.0,342 551 365
"https://m.media-amazon.com/images/M/MV5BNzQzOTk3OTAtNDQ0Zi00ZTVkLWI0MTEtMDllZjNkYzNjNTc4L2ltYWdlXkEyXkFqcGdeQXVyNjU0OTQ0OTY@._V1_UX67_CR0,0,67,98_AL_.jpg",the matrix,1999,a,136 min,action sci fi,8.7,when a beauti stranger lead comput hacker neo to a forbid underworld he discov the shock truth the life he know is the elabor decept of an evil cyber intellig,0.0,lana wachowski,lilli wachowski,keanu reev,laurenc fishburn,carri ann moss,0.0,171 479 930
"https://m.media-amazon.com/images/M/MV5BY2NkZjEzMDgtN2RjYy00YzM1LWI4ZmQtMjIwYjFjNmI3ZGEwXkEyXkFqcGdeQXVyNzkwMjQ5NzM@._V1_UX67_CR0,0,67,98_AL_.jpg",goodfella,1990,a,146 min,biographi crime drama,8.7,the stori of henri hill and hi life in the mob cover hi relationship with hi wife karen hill and hi mob partner jimmi conway and tommi devito in the italian american crime syndic,0.0,martin scorses,robert de niro,ray liotta,joe pesci,lorrain bracco,0.0,46 836 394
"https://m.media-amazon.com/images/M/MV5BYmU1NDRjNDgtMzhiMi00NjZmLTg5NGItZDNiZjU5NTU4OTE0XkEyXkFqcGdeQXVyNzkwMjQ5NzM@._V1_UX67_CR0,0,67,98_AL_.jpg",star war episod v the empir strike back,1980,ua,124 min,action adventur fantasi,8.7,after the rebel are brutal overpow by the empir on the ice planet hoth luke skywalk begin jedi train with yoda while hi friend are pursu by darth vader and a bounti hunter name boba fett all over the galaxi,0.0,irvin kershner,mark hamil,harrison ford,carri fisher,billi dee william,0.0,290 475 067
"https://m.media-amazon.com/images/M/MV5BZjA0OWVhOTAtYWQxNi00YzNhLWI4ZjYtNjFjZTEyYjJlNDVlL2ltYWdlL2ltYWdlXkEyXkFqcGdeQXVyMTQxNzMzNDI@._V1_UX67_CR0,0,67,98_AL_.jpg",one flew over the cuckoo s nest,1975,a,133 min,drama,8.7,a crimin plead insan and is admit to a mental institut where he rebel against the oppress nurs and ralli up the scare patient,0.0,milo forman,jack nicholson,louis fletcher,michael berryman,peter brocco,0.0,112 000 000
"https://m.media-amazon.com/images/M/MV5BNjViNWRjYWEtZTI0NC00N2E3LTk0NGQtMjY4NTM3OGNkZjY0XkEyXkFqcGdeQXVyMjUxMTY3ODM@._V1_UX67_CR0,0,67,98_AL_.jpg",hamilton,2020,pg 13,160 min,biographi drama histori,8.6,the real life of one of america s foremost found father and first secretari of the treasuri alexand hamilton captur live on broadway from the richard rodger theater with the origin broadway cast,0.0,thoma kail,lin manuel miranda,phillipa soo,lesli odom jr,ren e elis goldsberri,0.0,Unknown
"https://m.media-amazon.com/images/M/MV5BYWZjMjk3ZTItODQ2ZC00NTY5LWE0ZDYtZTI3MjcwN2Q5NTVkXkEyXkFqcGdeQXVyODk4OTc3MTY@._V1_UX67_CR0,0,67,98_AL_.jpg",gisaengchung,2019,a,132 min,comedi drama thriller,8.6,greed and class discrimin threaten the newli form symbiot relationship between the wealthi park famili and the destitut kim clan,0.0,bong joon ho,kang ho song,lee sun kyun,cho yeo jeong,choi woo sik,0.0,53 367 844
"https://m.media-amazon.com/images/M/MV5BOTc2ZTlmYmItMDBhYS00YmMzLWI4ZjAtMTI5YTBjOTFiMGEwXkEyXkFqcGdeQXVyODE5NzE3OTE@._V1_UY98_CR0,0,67,98_AL_.jpg",soorarai pottru,2020,u,153 min,drama,8.6,nedumaaran rajangam maara set out to make the common man fli and in the process take on the world s most capit intens industri and sever enemi who stand in hi way,0.0,sudha kongara,suriya,madhavan,paresh rawal,aparna balamurali,0.0,Unknown
"https://m.media-amazon.com/images/M/MV5BZjdkOTU3MDktN2IxOS00OGEyLWFmMjktY2FiMmZkNWIyODZiXkEyXkFqcGdeQXVyMTMxODk2OTU@._V1_UX67_CR0,0,67,98_AL_.jpg",interstellar,2014,ua,169 min,adventur drama sci fi,8.6,a team of explor travel through a wormhol in space in an attempt to ensur human s surviv,0.0,christoph nolan,matthew mcconaughey,ann hathaway,jessica chastain,mackenzi foy,0.0,188 020 017
"https://m.media-amazon.com/images/M/MV5BOTMwYjc5ZmItYTFjZC00ZGQ3LTlkNTMtMjZiNTZlMWQzNzI5XkEyXkFqcGdeQXVyNzkwMjQ5NzM@._V1_UX67_CR0,0,67,98_AL_.jpg",cidad de deu,2002,a,130 min,crime drama,8.6,in the slum of rio two kid path diverg as one struggl to becom a photograph and the other a kingpin,0.0,fernando meirel,k tia lund,alexandr rodrigu,leandro firmino,matheu nachtergael,0.0,7 563 397
"https://m.media-amazon.com/images/M/MV5BMjlmZmI5MDctNDE2YS00YWE0LWE5ZWItZDBhYWQ0NTcxNWRhXkEyXkFqcGdeQXVyMTMxODk2OTU@._V1_UX67_CR0,0,67,98_AL_.jpg",sen to chihiro no kamikakushi,2001,u,125 min,anim adventur famili,8.6,dure her famili s move to the suburb a sullen 10 year old girl wander into a world rule by god witch and spirit and where human are chang into beast,0.0,hayao miyazaki,daveigh chase,suzann pleshett,miyu irino,rumi hiiragi,0.0,10 055 859
"https://m.media-amazon.com/images/M/MV5BZjhkMDM4MWItZTVjOC00ZDRhLThmYTAtM2I5NzBmNmNlMzI1XkEyXkFqcGdeQXVyNDYyMDk5MTU@._V1_UX67_CR0,0,67,98_AL_.jpg",save privat ryan,1998,r,169 min,drama war,8.6,follow the normandi land a group of u s soldier go behind enemi line to retriev a paratroop whose brother have been kill in action,0.0,steven spielberg,tom hank,matt damon,tom sizemor,edward burn,0.0,216 540 909
"https://m.media-amazon.com/images/M/MV5BMTUxMzQyNjA5MF5BMl5BanBnXkFtZTYwOTU2NTY3._V1_UX67_CR0,0,67,98_AL_.jpg",the green mile,1999,a,189 min,crime drama fantasi,8.6,the live of guard on death row are affect by one of their charg a black man accus of child murder and rape yet who ha a mysteri gift,0.0,frank darabont,tom hank,michael clark duncan,david mors,bonni hunt,0.0,136 801 374
"https://m.media-amazon.com/images/M/MV5BYmJmM2Q4NmMtYThmNC00ZjRlLWEyZmItZTIwOTBlZDQ3NTQ1XkEyXkFqcGdeQXVyMTQxNzMzNDI@._V1_UX67_CR0,0,67,98_AL_.jpg",la vita bella,1997,u,116 min,comedi drama romanc,8.6,when an open mind jewish librarian and hi son becom victim of the holocaust he use a perfect mixtur of will humor and imagin to protect hi son from the danger around their camp,0.0,roberto benigni,roberto benigni,nicoletta braschi,giorgio cantarini,giustino durano,0.0,57 598 247
"https://m.media-amazon.com/images/M/MV5BOTUwODM5MTctZjczMi00OTk4LTg3NWUtNmVhMTAzNTNjYjcyXkEyXkFqcGdeQXVyNjU0OTQ0OTY@._V1_UX67_CR0,0,67,98_AL_.jpg",se7en,1995,a,127 min,crime drama mysteri,8.6,two detect a rooki and a veteran hunt a serial killer who use the seven deadli sin as hi motiv,0.0,david fincher,morgan freeman,brad pitt,kevin spacey,andrew kevin walker,0.0,100 125 643
"https://m.media-amazon.com/images/M/MV5BNjNhZTk0ZmEtNjJhMi00YzFlLWE1MmEtYzM1M2ZmMGMwMTU4XkEyXkFqcGdeQXVyNjU0OTQ0OTY@._V1_UX67_CR0,0,67,98_AL_.jpg",the silenc of the lamb,1991,a,118 min,crime drama thriller,8.6,a young f b i cadet must receiv the help of an incarcer and manipul cannib killer to help catch anoth serial killer a madman who skin hi victim,0.0,jonathan demm,jodi foster,anthoni hopkin,lawrenc a bonney,kasi lemmon,0.0,130 742 922
"https://m.media-amazon.com/images/M/MV5BNzVlY2MwMjktM2E4OS00Y2Y3LWE3ZjctYzhkZGM3YzA1ZWM2XkEyXkFqcGdeQXVyNzkwMjQ5NzM@._V1_UX67_CR0,0,67,98_AL_.jpg",star war,1977,ua,121 min,action adventur fantasi,8.6,luke skywalk join forc with a jedi knight a cocki pilot a wookie and two droid to save the galaxi from the empir s world destroy battl station while also attempt to rescu princess leia from the mysteri darth vader,0.0,georg luca,mark hamil,harrison ford,carri fisher,alec guin,0.0,322 740 140
"https://m.media-amazon.com/images/M/MV5BYjBmYTQ1NjItZWU5MS00YjI0LTg2OTYtYmFkN2JkMmNiNWVkXkEyXkFqcGdeQXVyMTMxMTY0OTQ@._V1_UY98_CR2,0,67,98_AL_.jpg",seppuku,1962,Unknown,133 min,action drama mysteri,8.6,when a ronin request seppuku at a feudal lord s palac is told of the brutal suicid of anoth ronin who previous visit he reveal how their past are intertwin and in do so challeng the clan s integr,0.0,masaki kobayashi,tatsuya nakadai,akira ishihama,shima iwashita,tetsur tanba,0.0,Unknown
"https://m.media-amazon.com/images/M/MV5BOWE4ZDdhNmMtNzE5ZC00NzExLTlhNGMtY2ZhYjYzODEzODA1XkEyXkFqcGdeQXVyNTAyODkwOQ@@._V1_UY98_CR1,0,67,98_AL_.jpg",shichinin no samurai,1954,u,207 min,action adventur drama,8.6,a poor villag under attack by bandit recruit seven unemploy samurai to help them defend themselv,0.0,akira kurosawa,toshir mifun,takashi shimura,keiko tsushima,yukiko shimazaki,0.0,269 061
"https://m.media-amazon.com/images/M/MV5BZjc4NDZhZWMtNGEzYS00ZWU2LThlM2ItNTA0YzQ0OTExMTE2XkEyXkFqcGdeQXVyNjUwMzI2NzU@._V1_UY98_CR0,0,67,98_AL_.jpg",it s a wonder life,1946,pg,130 min,drama famili fantasi,8.6,an angel is sent from heaven to help a desper frustrat businessman by show him what life would have been like if he had never exist,0.0,frank capra,jame stewart,donna reed,lionel barrymor,thoma mitchel,0.0,Unknown
"https://m.media-amazon.com/images/M/MV5BNGVjNWI4ZGUtNzE0MS00YTJmLWE0ZDctN2ZiYTk2YmI3NTYyXkEyXkFqcGdeQXVyMTkxNjUyNQ@@._V1_UX67_CR0,0,67,98_AL_.jpg",joker,2019,a,122 min,crime drama thriller,8.5,in gotham citi mental troubl comedian arthur fleck is disregard and mistreat by societi he then embark on a downward spiral of revolut and bloodi crime thi path bring him face to face with hi alter ego the joker,0.0,todd phillip,joaquin phoenix,robert de niro,zazi beetz,franc conroy,0.0,335 451 311
"https://m.media-amazon.com/images/M/MV5BOTA5NDZlZGUtMjAxOS00YTRkLTkwYmMtYWQ0NWEwZDZiNjEzXkEyXkFqcGdeQXVyMTMxODk2OTU@._V1_UX67_CR0,0,67,98_AL_.jpg",whiplash,2014,a,106 min,drama music,8.5,a promis young drummer enrol at a cut throat music conservatori where hi dream of great are mentor by an instructor who will stop at noth to realiz a student s potenti,0.0,damien chazel,mile teller,j k simmon,melissa benoist,paul reiser,0.0,13 092 000
"https://m.media-amazon.com/images/M/MV5BMTYxNDA3MDQwNl5BMl5BanBnXkFtZTcwNTU4Mzc1Nw@@._V1_UX67_CR0,0,67,98_AL_.jpg",the intouch,2011,ua,112 min,biographi comedi drama,8.5,after he becom a quadripleg from a paraglid accid an aristocrat hire a young man from the project to be hi caregiv,0.0,olivi nakach,ric toledano,fran oi cluzet,omar sy,ann le ny,0.0,13 182 281
"https://m.media-amazon.com/images/M/MV5BMjA4NDI0MTIxNF5BMl5BanBnXkFtZTYwNTM0MzY2._V1_UX67_CR0,0,67,98_AL_.jpg",the prestig,2006,u,130 min,drama mysteri sci fi,8.5,after a tragic accid two stage magician engag in a battl to creat the ultim illus while sacrif everyth they have to outwit each other,0.0,christoph nolan,christian bale,hugh jackman,scarlett johansson,michael cain,0.0,53 089 891
"https://m.media-amazon.com/images/M/MV5BMTI1MTY2OTIxNV5BMl5BanBnXkFtZTYwNjQ4NjY3._V1_UX67_CR0,0,67,98_AL_.jpg",the depart,2006,a,151 min,crime drama thriller,8.5,an undercov cop and a mole in the polic attempt to identifi each other while infiltr an irish gang in south boston,0.0,martin scorses,leonardo dicaprio,matt damon,jack nicholson,mark wahlberg,0.0,132 384 315
"https://m.media-amazon.com/images/M/MV5BOWRiZDIxZjktMTA1NC00MDQ2LWEzMjUtMTliZmY3NjQ3ODJiXkEyXkFqcGdeQXVyNjU0OTQ0OTY@._V1_UY98_CR2,0,67,98_AL_.jpg",the pianist,2002,r,150 min,biographi drama music,8.5,a polish jewish musician struggl to surviv the destruct of the warsaw ghetto of world war ii,0.0,roman polanski,adrien brodi,thoma kretschmann,frank finlay,emilia fox,0.0,32 572 577
"https://m.media-amazon.com/images/M/MV5BMDliMmNhNDEtODUyOS00MjNlLTgxODEtN2U3NzIxMGVkZTA1L2ltYWdlXkEyXkFqcGdeQXVyNjU0OTQ0OTY@._V1_UX67_CR0,0,67,98_AL_.jpg",gladiat,2000,ua,155 min,action adventur drama,8.5,a former roman gener set out to exact vengeanc against the corrupt emperor who murder hi famili and sent him into slaveri,0.0,ridley scott,russel crow,joaquin phoenix,conni nielsen,oliv reed,0.0,187 705 427
"https://m.media-amazon.com/images/M/MV5BZjA0MTM4MTQtNzY5MC00NzY3LWI1ZTgtYzcxMjkyMzU4MDZiXkEyXkFqcGdeQXVyNDYyMDk5MTU@._V1_UX67_CR0,0,67,98_AL_.jpg",american histori x,1998,r,119 min,drama,8.5,a former neo nazi skinhead tri to prevent hi younger brother from go down the same wrong path that he did,0.0,toni kay,edward norton,edward furlong,beverli d angelo,jennif lien,0.0,6 719 864
"https://m.media-amazon.com/images/M/MV5BYTViNjMyNmUtNDFkNC00ZDRlLThmMDUtZDU2YWE4NGI2ZjVmXkEyXkFqcGdeQXVyNjU0OTQ0OTY@._V1_UX67_CR0,0,67,98_AL_.jpg",the usual suspect,1995,a,106 min,crime mysteri thriller,8.5,a sole survivor tell of the twisti event lead up to a horrif gun battl on a boat which began when five crimin met at a seemingli random polic lineup,0.0,bryan singer,kevin spacey,gabriel byrn,chazz palminteri,stephen baldwin,0.0,23 341 568
"https://m.media-amazon.com/images/M/MV5BODllNWE0MmEtYjUwZi00ZjY3LThmNmQtZjZlMjI2YTZjYmQ0XkEyXkFqcGdeQXVyNTc1NTQxODI@._V1_UX67_CR0,0,67,98_AL_.jpg",l on,1994,a,110 min,action crime drama,8.5,mathilda a 12 year old girl is reluctantli taken in by l on a profession assassin after her famili is murder an unusu relationship form as she becom hi prot g e and learn the assassin s trade,0.0,luc besson,jean reno,gari oldman,natali portman,danni aiello,0.0,19 501 238
"https://m.media-amazon.com/images/M/MV5BYTYxNGMyZTYtMjE3MS00MzNjLWFjNmYtMDk3N2FmM2JiM2M1XkEyXkFqcGdeQXVyNjY5NDU4NzI@._V1_UX67_CR0,0,67,98_AL_.jpg",the lion king,1994,u,88 min,anim adventur drama,8.5,lion princ simba and hi father are target by hi bitter uncl who want to ascend the throne himself,0.0,roger aller,rob minkoff,matthew broderick,jeremi iron,jame earl jone,0.0,422 783 777
"https://m.media-amazon.com/images/M/MV5BMGU2NzRmZjUtOGUxYS00ZjdjLWEwZWItY2NlM2JhNjkxNTFmXkEyXkFqcGdeQXVyNjU0OTQ0OTY@._V1_UX67_CR0,0,67,98_AL_.jpg",termin 2 judgment day,1991,u,137 min,action sci fi,8.5,a cyborg ident to the one who fail to kill sarah connor must now protect her teenag son john connor from a more advanc and power cyborg,0.0,jame cameron,arnold schwarzenegg,linda hamilton,edward furlong,robert patrick,0.0,204 843 350
"https://m.media-amazon.com/images/M/MV5BM2FhYjEyYmYtMDI1Yy00YTdlLWI2NWQtYmEzNzAxOGY1NjY2XkEyXkFqcGdeQXVyNTA3NTIyNDg@._V1_UX67_CR0,0,67,98_AL_.jpg",nuovo cinema paradiso,1988,u,155 min,drama romanc,8.5,a filmmak recal hi childhood when fall in love with the pictur at the cinema of hi home villag and form a deep friendship with the cinema s projectionist,0.0,giusepp tornator,philipp noiret,enzo cannaval,antonella attili,isa dani,0.0,11 990 401
"https://m.media-amazon.com/images/M/MV5BZmY2NjUzNDQtNTgxNC00M2Q4LTljOWQtMjNjNDBjNWUxNmJlXkEyXkFqcGdeQXVyNTA4NzY1MzY@._V1_UX67_CR0,0,67,98_AL_.jpg",hotaru no haka,1988,u,89 min,anim drama war,8.5,a young boy and hi littl sister struggl to surviv in japan dure world war ii,0.0,isao takahata,tsutomu tatsumi,ayano shiraishi,akemi yamaguchi,yoshiko shinohara,0.0,Unknown
"https://m.media-amazon.com/images/M/MV5BZmU0M2Y1OGUtZjIxNi00ZjBkLTg1MjgtOWIyNThiZWIwYjRiXkEyXkFqcGdeQXVyMTQxNzMzNDI@._V1_UX67_CR0,0,67,98_AL_.jpg",back to the futur,1985,u,116 min,adventur comedi sci fi,8.5,marti mcfli a 17 year old high school student is accident sent thirti year into the past in a time travel delorean invent by hi close friend the eccentr scientist doc brown,0.0,robert zemecki,michael j fox,christoph lloyd,lea thompson,crispin glover,0.0,210 609 762
"https://m.media-amazon.com/images/M/MV5BZGI5MjBmYzYtMzJhZi00NGI1LTk3MzItYjBjMzcxM2U3MDdiXkEyXkFqcGdeQXVyNzkwMjQ5NzM@._V1_UX67_CR0,0,67,98_AL_.jpg",onc upon a time in the west,1968,u,165 min,western,8.5,a mysteri stranger with a harmonica join forc with a notori desperado to protect a beauti widow from a ruthless assassin work for the railroad,0.0,sergio leon,henri fonda,charl bronson,claudia cardinal,jason robard,0.0,5 321 508
"https://m.media-amazon.com/images/M/MV5BNTQwNDM1YzItNDAxZC00NWY2LTk0M2UtNDIwNWI5OGUyNWUxXkEyXkFqcGdeQXVyNzkwMjQ5NzM@._V1_UX67_CR0,0,67,98_AL_.jpg",psycho,1960,a,109 min,horror mysteri thriller,8.5,a phoenix secretari embezzl 40 000 from her employ s client goe on the run and check into a remot motel run by a young man under the domin of hi mother,0.0,alfr hitchcock,anthoni perkin,janet leigh,vera mile,john gavin,0.0,32 000 000
"https://m.media-amazon.com/images/M/MV5BY2IzZGY2YmEtYzljNS00NTM5LTgwMzUtMzM1NjQ4NGI0OTk0XkEyXkFqcGdeQXVyNDYyMDk5MTU@._V1_UX67_CR0,0,67,98_AL_.jpg",casablanca,1942,u,102 min,drama romanc war,8.5,a cynic expatri american cafe owner struggl to decid whether or not to help hi former lover and her fugit husband escap the nazi in french morocco,0.0,michael curtiz,humphrey bogart,ingrid bergman,paul henreid,claud rain,0.0,1 024 560
"https://m.media-amazon.com/images/M/MV5BYjJiZjMzYzktNjU0NS00OTkxLWEwYzItYzdhYWJjN2QzMTRlL2ltYWdlL2ltYWdlXkEyXkFqcGdeQXVyNjU0OTQ0OTY@._V1_UX67_CR0,0,67,98_AL_.jpg",modern time,1936,g,87 min,comedi drama famili,8.5,the tramp struggl to live in modern industri societi with the help of a young homeless woman,0.0,charl chaplin,charl chaplin,paulett goddard,henri bergman,tini sandford,0.0,163 245
"https://m.media-amazon.com/images/M/MV5BY2I4MmM1N2EtM2YzOS00OWUzLTkzYzctNDc5NDg2N2IyODJmXkEyXkFqcGdeQXVyNzkwMjQ5NzM@._V1_UX67_CR0,0,67,98_AL_.jpg",citi light,1931,g,87 min,comedi drama romanc,8.5,with the aid of a wealthi errat tippler a dewi eye tramp who ha fallen in love with a sightless flower girl accumul money to be abl to help her medic,0.0,charl chaplin,charl chaplin,virginia cherril,florenc lee,harri myer,0.0,19 181
"https://m.media-amazon.com/images/M/MV5BMmExNzU2ZWMtYzUwYi00YmM2LTkxZTQtNmVhNjY0NTMyMWI2XkEyXkFqcGdeQXVyMTMxODk2OTU@._V1_UX67_CR0,0,67,98_AL_.jpg",capharna m,2018,a,126 min,drama,8.4,while serv a five year sentenc for a violent crime a 12 year old boy sue hi parent for neglect,0.0,nadin labaki,zain al rafeea,yordano shiferaw,boluwatif treasur bankol,kawsar al haddad,0.0,1 661 096
"https://m.media-amazon.com/images/M/MV5BNWJhMDlmZGUtYzcxNS00NDRiLWIwNjktNDY1Mjg3ZjBkYzY0XkEyXkFqcGdeQXVyMTU4MjUwMjI@._V1_UY98_CR2,0,67,98_AL_.jpg",ayla the daughter of war,2017,Unknown,125 min,biographi drama histori,8.4,in 1950 amid st the ravag of the korean war sergeant s leyman stumbl upon a half frozen littl girl with no parent and no help in sight frantic scare and on the verg of death see full summari,0.0,can ulkay,erdem can,etin tekindor,ismail hacioglu,kyung jin lee,0.0,Unknown
"https://m.media-amazon.com/images/M/MV5BY2FiMTFmMzMtZDI2ZC00NDQyLWExYTUtOWNmZWM1ZDg5YjVjXkEyXkFqcGdeQXVyODIwMDI1NjM@._V1_UX67_CR0,0,67,98_AL_.jpg",vikram vedha,2017,ua,147 min,action crime drama,8.4,vikram a no nonsens polic offic accompani by simon hi partner is on the hunt to captur vedha a smuggler and a murder vedha tri to chang vikram s life which lead to a conflict,0.0,gayatri,pushkar,madhavan,vijay sethupathi,shraddha srinath,0.0,Unknown
"https://m.media-amazon.com/images/M/MV5BODRmZDVmNzUtZDA4ZC00NjhkLWI2M2UtN2M0ZDIzNDcxYThjL2ltYWdlXkEyXkFqcGdeQXVyNTk0MzMzODA@._V1_UX67_CR0,0,67,98_AL_.jpg",kimi no na wa,2016,u,106 min,anim drama fantasi,8.4,two stranger find themselv link in a bizarr way when a connect form will distanc be the onli thing to keep them apart,0.0,makoto shinkai,ry nosuk kamiki,mone kamishiraishi,ry narita,aoi y ki,0.0,5 017 246
"https://m.media-amazon.com/images/M/MV5BMTQ4MzQzMzM2Nl5BMl5BanBnXkFtZTgwMTQ1NzU3MDI@._V1_UY98_CR1,0,67,98_AL_.jpg",dangal,2016,u,161 min,action biographi drama,8.4,former wrestler mahavir singh phogat and hi two wrestler daughter struggl toward glori at the commonwealth game in the face of societ oppress,0.0,nitesh tiwari,aamir khan,sakshi tanwar,fatima sana shaikh,sanya malhotra,0.0,12 391 761
"https://m.media-amazon.com/images/M/MV5BMjMwNDkxMTgzOF5BMl5BanBnXkFtZTgwNTkwNTQ3NjM@._V1_UX67_CR0,0,67,98_AL_.jpg",spider man into the spider vers,2018,u,117 min,anim action adventur,8.4,teen mile moral becom the spider man of hi univers and must join with five spider power individu from other dimens to stop a threat for all realiti,0.0,bob persichetti,peter ramsey,rodney rothman,shameik moor,jake johnson,0.0,190 241 310
"https://m.media-amazon.com/images/M/MV5BMTc5MDE2ODcwNV5BMl5BanBnXkFtZTgwMzI2NzQ2NzM@._V1_UX67_CR0,0,67,98_AL_.jpg",aveng endgam,2019,ua,181 min,action adventur drama,8.4,after the devast event of aveng infin war 2018 the univers is in ruin with the help of remain alli the aveng assembl onc more in order to revers thano action and restor balanc to the univers,0.0,anthoni russo,joe russo,robert downey jr,chri evan,mark ruffalo,0.0,858 373 000
