Poster_Link,Series_Title,Released_Year,Certificate,Runtime,Genre,IMDB_Rating,Overview,Meta_score,Director,Star1,Star2,Star3,Star4,No_of_Votes,Gross
"https://m.media-amazon.com/images/M/MV5BNjE5MzYwMzYxMF5BMl5BanBnXkFtZTcwOTk4MTk0OQ@@._V1_UX67_CR0,0,67,98_AL_.jpg",graviti,2013,ua,91 min,drama sci fi thriller,7.7,two astronaut work togeth to surviv after an accid leav them strand in space,0.0,alfonso cuar n,sandra bullock,georg clooney,ed harri,orto ignatiussen,0.0,274 092 705
"https://m.media-amazon.com/images/M/MV5BMTk2NzczOTgxNF5BMl5BanBnXkFtZTcwODQ5ODczOQ@@._V1_UX67_CR0,0,67,98_AL_.jpg",star trek into dark,2013,ua,132 min,action adventur sci fi,7.7,after the crew of the enterpris find an unstopp forc of terror from within their own organ captain kirk lead a manhunt to a war zone world to captur a one man weapon of mass destruct,0.0,j j abram,chri pine,zachari quinto,zoe saldana,benedict cumberbatch,0.0,228 778 661
"https://m.media-amazon.com/images/M/MV5BMTYwMzMzMDI0NF5BMl5BanBnXkFtZTgwNDQ3NjI3NjE@._V1_UX67_CR0,0,67,98_AL_.jpg",beast of no nation,2015,Unknown,137 min,drama war,7.7,a drama base on the experi of agu a child soldier fight in the civil war of an unnam african countri,0.0,cari joji fukunaga,abraham attah,emmanuel affadzi,ricki adelayitor,andrew adot,0.0,83 861
"https://m.media-amazon.com/images/M/MV5BOGUyZDUxZjEtMmIzMC00MzlmLTg4MGItZWJmMzBhZjE0Mjc1XkEyXkFqcGdeQXVyMTMxODk2OTU@._V1_UX67_CR0,0,67,98_AL_.jpg",the social network,2010,ua,120 min,biographi drama,7.7,as harvard student mark zuckerberg creat the social network site that would becom known as facebook he is su by the twin who claim he stole their idea and by the co founder who wa later squeez out of the busi,0.0,david fincher,jess eisenberg,andrew garfield,justin timberlak,rooney mara,0.0,96 962 694
"https://m.media-amazon.com/images/M/MV5BMTg5OTMxNzk4Nl5BMl5BanBnXkFtZTcwOTk1MjAwNQ@@._V1_UX67_CR0,0,67,98_AL_.jpg",x first class,2011,ua,131 min,action adventur sci fi,7.7,in the 1960 superpow human charl xavier and erik lensherr work togeth to find other like them but erik s veng pursuit of an ambiti mutant who ruin hi life caus a schism to divid them,0.0,matthew vaughn,jame mcavoy,michael fassbend,jennif lawrenc,kevin bacon,0.0,146 408 305
"https://m.media-amazon.com/images/M/MV5BNGQwZjg5YmYtY2VkNC00NzliLTljYTctNzI5NmU3MjE2ODQzXkEyXkFqcGdeQXVyNzkwMjQ5NzM@._V1_UX67_CR0,0,67,98_AL_.jpg",the hangov,2009,ua,100 min,comedi,7.7,three buddi wake up from a bachelor parti in la vega with no memori of the previou night and the bachelor miss they make their way around the citi in order to find their friend befor hi wed,0.0,todd phillip,zach galifianaki,bradley cooper,justin bartha,ed helm,0.0,277 322 503
"https://m.media-amazon.com/images/M/MV5BMWZiNjE2OWItMTkwNy00ZWQzLWI0NTgtMWE0NjNiYTljN2Q1XkEyXkFqcGdeQXVyNzAwMjYxMzA@._V1_UX67_CR0,0,67,98_AL_.jpg",skyfal,2012,ua,143 min,action adventur thriller,7.7,jame bond s loyalti to m is test when her past come back to haunt her when mi6 come under attack 007 must track down and destroy the threat no matter how person the cost,0.0,sam mend,daniel craig,javier bardem,naomi harri,judi dench,0.0,304 360 277
"https://m.media-amazon.com/images/M/MV5BMTM2MTI5NzA3MF5BMl5BanBnXkFtZTcwODExNTc0OA@@._V1_UX67_CR0,0,67,98_AL_.jpg",silver line playbook,2012,a,122 min,comedi drama romanc,7.7,after a stint in a mental institut former teacher pat solitano move back in with hi parent and tri to reconcil with hi ex wife thing get more challeng when pat meet tiffani a mysteri girl with problem of her own,0.0,david o russel,bradley cooper,jennif lawrenc,robert de niro,jacki weaver,0.0,132 092 958
"https://m.media-amazon.com/images/M/MV5BNzljNjY3MDYtYzc0Ni00YjU0LWIyNDUtNTE0ZDRiMGExMjZlXkEyXkFqcGdeQXVyMTMxODk2OTU@._V1_UX67_CR0,0,67,98_AL_.jpg",argo,2012,a,120 min,biographi drama thriller,7.7,act under the cover of a hollywood produc scout a locat for a scienc fiction film a cia agent launch a danger oper to rescu six american in tehran dure the u s hostag crisi in iran in 1979,0.0,ben affleck,ben affleck,bryan cranston,john goodman,alan arkin,0.0,136 025 503
"https://m.media-amazon.com/images/M/MV5BMTk5MjM4OTU1OV5BMl5BanBnXkFtZTcwODkzNDIzMw@@._V1_UX67_CR0,0,67,98_AL_.jpg",500 day of summer,2009,ua,95 min,comedi drama romanc,7.7,an offbeat romant comedi about a woman who doesn t believ true love exist and the young man who fall for her,0.0,marc webb,zooey deschanel,joseph gordon levitt,geoffrey arend,chlo grace moretz,0.0,32 391 374
"https://m.media-amazon.com/images/M/MV5BMTQ2OTE1Mjk0N15BMl5BanBnXkFtZTcwODE3MDAwNA@@._V1_UX67_CR0,0,67,98_AL_.jpg",harri potter and the deathli hallow part 1,2010,a,146 min,adventur famili fantasi,7.7,as harri ron and hermion race against time and evil to destroy the horcrux they uncov the exist of the three most power object in the wizard world the deathli hallow,0.0,david yate,daniel radcliff,emma watson,rupert grint,bill nighi,0.0,295 983 305
"https://m.media-amazon.com/images/M/MV5BOTc3YmM3N2QtODZkMC00ZDE5LThjMTQtYTljN2Y1YTYwYWJkXkEyXkFqcGdeQXVyODEzNjM5OTQ@._V1_UX67_CR0,0,67,98_AL_.jpg",gake no ue no ponyo,2008,u,101 min,anim adventur comedi,7.7,a five year old boy develop a relationship with ponyo a young goldfish princess who long to becom a human after fall in love with him,0.0,hayao miyazaki,cate blanchett,matt damon,liam neeson,tomoko yamaguchi,0.0,15 090 400
"https://m.media-amazon.com/images/M/MV5BOTY4NTU2NTU4NF5BMl5BanBnXkFtZTcwNjE0OTc5MQ@@._V1_UX67_CR0,0,67,98_AL_.jpg",frost nixon,2008,r,122 min,biographi drama histori,7.7,a dramat retel of the post waterg televis interview between british talk show host david frost and former presid richard nixon,0.0,ron howard,frank langella,michael sheen,kevin bacon,sam rockwel,0.0,18 593 156
"https://m.media-amazon.com/images/M/MV5BNDliMTMxOWEtODM3Yi00N2QwLTg4YTAtNTE5YzBlNTA2NjhlXkEyXkFqcGdeQXVyNjE5MjUyOTM@._V1_UX67_CR0,0,67,98_AL_.jpg",papurika,2006,u,90 min,anim drama fantasi,7.7,when a machin that allow therapist to enter their patient dream is stolen all hell break loos onli a young femal therapist paprika can stop it,0.0,satoshi kon,megumi hayashibara,t ru emori,katsunosuk hori,t ru furuya,0.0,881 302
"https://m.media-amazon.com/images/M/MV5BOTA1Mzg3NjIxNV5BMl5BanBnXkFtZTcwNzU2NTc5MQ@@._V1_UX67_CR0,0,67,98_AL_.jpg",changel,2008,r,141 min,biographi crime drama,7.7,grief stricken mother christin collin angelina joli take on the l a p d to her own detriment when it tri to pass off an obviou impostor as her miss child,0.0,clint eastwood,angelina joli,colm feor,ami ryan,gattlin griffith,0.0,35 739 802
"https://m.media-amazon.com/images/M/MV5BMTU2NjQ1Nzc4MF5BMl5BanBnXkFtZTcwNTM0NDk1Mw@@._V1_UX67_CR0,0,67,98_AL_.jpg",flip,2010,pg,90 min,comedi drama romanc,7.7,two eighth grader start to have feel for each other despit be total opposit,0.0,rob reiner,madelin carrol,callan mcauliff,rebecca de mornay,anthoni edward,0.0,1 752 214
"https://m.media-amazon.com/images/M/MV5BMzA4ZGM1NjYtMjcxYS00MTdiLWJmNzEtMTUzODY0NDQ0YzUzXkEyXkFqcGdeQXVyMzYwMjQ3OTI@._V1_UY98_CR1,0,67,98_AL_.jpg",toki o kakeru sh jo,2006,u,98 min,anim adventur comedi,7.7,a high school girl name makoto acquir the power to travel back in time and decid to use it for her own person benefit littl doe she know that she is affect the live of other just as much as she is her own,0.0,mamoru hosoda,riisa naka,takuya ishida,mitsutaka itakura,ayami kakiuchi,0.0,Unknown
"https://m.media-amazon.com/images/M/MV5BZDNlNjEzMzQtZDM0MS00YzhiLTk0MGUtYTdmNDZiZGVjNTk0L2ltYWdlXkEyXkFqcGdeQXVyNTAyODkwOQ@@._V1_UY98_CR1,0,67,98_AL_.jpg",death note desu n to,2006,Unknown,126 min,crime drama fantasi,7.7,a battl between the world s two greatest mind begin when light yagami find the death note a notebook with the power to kill and decid to rid the world of crimin,0.0,sh suke kaneko,tatsuya fujiwara,ken ichi matsuyama,asaka seto,y kashii,0.0,Unknown
"https://m.media-amazon.com/images/M/MV5BMmE3OWZhZDYtOTBjMi00NDIwLTg1NWMtMjg0NjJmZWM4MjliL2ltYWdlXkEyXkFqcGdeQXVyNTAyODkwOQ@@._V1_UX67_CR0,0,67,98_AL_.jpg",thi is england,2006,Unknown,101 min,crime drama,7.7,a young boy becom friend with a gang of skinhead friend soon becom like famili and relationship will be push to the veri limit,0.0,shane meadow,thoma turgoos,stephen graham,jo hartley,andrew shim,0.0,327 919
"https://m.media-amazon.com/images/M/MV5BMTUxNzc0OTIxMV5BMl5BanBnXkFtZTgwNDI3NzU2NDE@._V1_UX67_CR0,0,67,98_AL_.jpg",ex machina,2014,ua,108 min,drama sci fi thriller,7.7,a young programm is select to particip in a ground break experi in synthet intellig by evalu the human qualiti of a highli advanc humanoid a i,0.0,alex garland,alicia vikand,domhnal gleeson,oscar isaac,sonoya mizuno,0.0,25 442 958
"https://m.media-amazon.com/images/M/MV5BMjIxODEyOTQ5Ml5BMl5BanBnXkFtZTcwNjE3NzI5Mw@@._V1_UY98_CR1,0,67,98_AL_.jpg",efter brylluppet,2006,r,120 min,drama,7.7,a manag of an orphanag in india is sent to copenhagen denmark where he discov a life alter famili secret,0.0,susann bier,mad mikkelsen,sids babett knudsen,rolf lassg rd,neeral mulchandani,0.0,412 544
"https://m.media-amazon.com/images/M/MV5BMjM1NTkxNjkzMl5BMl5BanBnXkFtZTgwNDgwMDAxMzE@._V1_UY98_CR1,0,67,98_AL_.jpg",the last king of scotland,2006,r,123 min,biographi drama histori,7.7,base on the event of the brutal ugandan dictat idi amin s regim as seen by hi person physician dure the 1970,0.0,kevin macdonald,jame mcavoy,forest whitak,gillian anderson,kerri washington,0.0,17 605 861
"https://m.media-amazon.com/images/M/MV5BN2UwNDc5NmEtNjVjZS00OTI5LWE5YjctMWM3ZjBiZGYwMGI2XkEyXkFqcGdeQXVyNzkwMjQ5NzM@._V1_UX67_CR0,0,67,98_AL_.jpg",zodiac,2007,ua,157 min,crime drama mysteri,7.7,in the late 1960 earli 1970 a san francisco cartoonist becom an amateur detect obsess with track down the zodiac killer an unidentifi individu who terror northern california with a kill spree,0.0,david fincher,jake gyllenha,robert downey jr,mark ruffalo,anthoni edward,0.0,33 080 084
"https://m.media-amazon.com/images/M/MV5BZjczMWI1YWMtYTZjOS00ZDc5LWE2MWItMTY3ZGUxNzFkNjJmL2ltYWdlXkEyXkFqcGdeQXVyNjU0OTQ0OTY@._V1_UX67_CR0,0,67,98_AL_.jpg",lucki number slevin,2006,r,110 min,action crime drama,7.7,a case of mistaken ident land slevin into the middl of a war be plot by two of the citi s most rival crime boss under constant surveil by detect brikowski and assassin goodkat he must get them befor they get him,0.0,paul mcguigan,josh hartnett,ben kingsley,morgan freeman,luci liu,0.0,22 494 487
"https://m.media-amazon.com/images/M/MV5BMTQyODczNjU3NF5BMl5BanBnXkFtZTcwNjQ0NDIzMQ@@._V1_UX67_CR0,0,67,98_AL_.jpg",joyeux no l,2005,pg 13,116 min,drama histori music,7.7,in decemb 1914 an unoffici christma truce on the western front allow soldier from oppos side of the first world war to gain insight into each other s way of life,0.0,christian carion,dian kruger,benno f rmann,guillaum canet,natali dessay,0.0,1 054 361
"https://m.media-amazon.com/images/M/MV5BNTEzOTYwMTcxN15BMl5BanBnXkFtZTcwNTgyNjI1MQ@@._V1_UX67_CR0,0,67,98_AL_.jpg",control,2007,r,122 min,biographi drama music,7.7,a profil of ian curti the enigmat singer of joy divis whose person profession and romant troubl led him to commit suicid at the age of 23,0.0,anton corbijn,sam riley,samantha morton,craig parkinson,alexandra maria lara,0.0,871 577
"https://m.media-amazon.com/images/M/MV5BMTAxNDYxMjg0MjNeQTJeQWpwZ15BbWU3MDcyNTk2OTM@._V1_UX67_CR0,0,67,98_AL_.jpg",tangl,2010,u,100 min,anim adventur comedi,7.7,the magic long hair rapunzel ha spent her entir life in a tower but now that a runaway thief ha stumbl upon her she is about to discov the world for the first time and who she realli is,0.0,nathan greno,byron howard,mandi moor,zachari levi,donna murphi,0.0,200 821 936
"https://m.media-amazon.com/images/M/MV5BODFlNTI0ZWQtOTcxNC00OTc0LTkwZDUtMmNkM2I1ZWFlYzZkXkEyXkFqcGdeQXVyNTIzOTk5ODM@._V1_UY98_CR2,0,67,98_AL_.jpg",zwartboek,2006,r,145 min,drama thriller war,7.7,in the nazi occupi netherland dure world war ii a jewish singer infiltr the region gestapo headquart for the dutch resist,0.0,paul verhoeven,caric van houten,sebastian koch,thom hoffman,halina reijn,0.0,4 398 392
"https://m.media-amazon.com/images/M/MV5BMTY5NTAzNTc1NF5BMl5BanBnXkFtZTYwNDY4MDc3._V1_UX67_CR0,0,67,98_AL_.jpg",brokeback mountain,2005,a,134 min,drama romanc,7.7,the stori of a forbidden and secret relationship between two cowboy and their live over the year,0.0,ang lee,jake gyllenha,heath ledger,michel william,randi quaid,0.0,83 043 761
"https://m.media-amazon.com/images/M/MV5BODE0NTcxNTQzNF5BMl5BanBnXkFtZTcwMzczOTIzMw@@._V1_UX67_CR0,0,67,98_AL_.jpg",3 10 to yuma,2007,a,122 min,action crime drama,7.7,a small time rancher agre to hold a captur outlaw who s await a train to go to court in yuma a battl of will ensu as the outlaw tri to psych out the rancher,0.0,jame mangold,russel crow,christian bale,ben foster,logan lerman,0.0,53 606 916
"https://m.media-amazon.com/images/M/MV5BOTk1OTA1MjIyNV5BMl5BanBnXkFtZTcwODQxMTkyMQ@@._V1_UX67_CR0,0,67,98_AL_.jpg",crash,2004,ua,112 min,crime drama thriller,7.7,lo angel citizen with vastli separ live collid in interweav stori of race loss and redempt,0.0,paul haggi,don cheadl,sandra bullock,thandi newton,karina arroyav,0.0,54 580 300
"https://m.media-amazon.com/images/M/MV5BMjZiOTNlMzYtZWYwZS00YWJjLTk5NDgtODkwNjRhMDI0MjhjXkEyXkFqcGdeQXVyMjgyNjk3MzE@._V1_UY98_CR1,0,67,98_AL_.jpg",kung fu,2004,ua,99 min,action comedi fantasi,7.7,in shanghai china in the 1940 a wannab gangster aspir to join the notori axe gang while resid of a hous complex exhibit extraordinari power in defend their turf,0.0,stephen chow,stephen chow,wah yuen,qiu yuen,siu lung leung,0.0,17 108 591
"https://m.media-amazon.com/images/M/MV5BYTIyMDFmMmItMWQzYy00MjBiLTg2M2UtM2JiNDRhOWE4NjBhXkEyXkFqcGdeQXVyNjU0OTQ0OTY@._V1_UX67_CR0,0,67,98_AL_.jpg",the bourn supremaci,2004,a,108 min,action mysteri thriller,7.7,when jason bourn is frame for a cia oper gone awri he is forc to resum hi former life as a train assassin to surviv,0.0,paul greengrass,matt damon,franka potent,joan allen,brian cox,0.0,176 241 941
"https://m.media-amazon.com/images/M/MV5BNjk1NzBlY2YtNjJmNi00YTVmLWI2OTgtNDUxNDE5NjUzZmE0XkEyXkFqcGdeQXVyNTc1NTQxODI@._V1_UX67_CR0,0,67,98_AL_.jpg",the machinist,2004,r,101 min,drama thriller,7.7,an industri worker who hasn t slept in a year begin to doubt hi own saniti,0.0,brad anderson,christian bale,jennif jason leigh,aitana s nchez gij n,john sharian,0.0,1 082 715
"https://m.media-amazon.com/images/M/MV5BMTQxNDQwNjQzOV5BMl5BanBnXkFtZTcwNTQxNDYyMQ@@._V1_UX67_CR0,0,67,98_AL_.jpg",ray,2004,a,152 min,biographi drama music,7.7,the stori of the life and career of the legendari rhythm and blue musician ray charl from hi humbl begin in the south where he went blind at age seven to hi meteor rise to stardom dure the 1950 and 1960,0.0,taylor hackford,jami foxx,regina king,kerri washington,clifton powel,0.0,75 331 600
"https://m.media-amazon.com/images/M/MV5BMTI2NDI5ODk4N15BMl5BanBnXkFtZTYwMTI3NTE3._V1_UX67_CR0,0,67,98_AL_.jpg",lost in translat,2003,ua,102 min,comedi drama,7.7,a fade movi star and a neglect young woman form an unlik bond after cross path in tokyo,0.0,sofia coppola,bill murray,scarlett johansson,giovanni ribisi,anna fari,0.0,44 585 453
"https://m.media-amazon.com/images/M/MV5BMTI1NDMyMjExOF5BMl5BanBnXkFtZTcwOTc4MjQzMQ@@._V1_UX67_CR0,0,67,98_AL_.jpg",harri potter and the goblet of fire,2005,ua,157 min,adventur famili fantasi,7.7,harri potter find himself compet in a hazard tournament between rival school of magic but he is distract by recur nightmar,0.0,mike newel,daniel radcliff,emma watson,rupert grint,eric syke,0.0,290 013 036
"https://m.media-amazon.com/images/M/MV5BODFlMmEwMDgtYjhmZi00ZTE5LTk2NWQtMWE1Y2M0NjkzOGYxXkEyXkFqcGdeQXVyNjU0OTQ0OTY@._V1_UX67_CR0,0,67,98_AL_.jpg",man on fire,2004,ua,146 min,action crime drama,7.7,in mexico citi a former cia oper swear vengeanc on those who commit an unspeak act against the famili he wa hire to protect,0.0,toni scott,denzel washington,christoph walken,dakota fan,radha mitchel,0.0,77 911 774
"https://m.media-amazon.com/images/M/MV5BMzQxNjM5NzkxNV5BMl5BanBnXkFtZTcwMzg5NDMwMg@@._V1_UX67_CR0,0,67,98_AL_.jpg",coralin,2009,u,100 min,anim drama famili,7.7,an adventur 11 year old girl find anoth world that is a strang ideal version of her frustrat home but it ha sinist secret,0.0,henri selick,dakota fan,teri hatcher,john hodgman,jennif saunder,0.0,75 286 229
"https://m.media-amazon.com/images/M/MV5BMzkyNzQ1Mzc0NV5BMl5BanBnXkFtZTcwODg3MzUzMw@@._V1_UX67_CR0,0,67,98_AL_.jpg",the last samurai,2003,ua,154 min,action drama,7.7,an american militari advisor embrac the samurai cultur he wa hire to destroy after he is captur in battl,0.0,edward zwick,tom cruis,ken watanab,billi connolli,william atherton,0.0,111 110 575
"https://m.media-amazon.com/images/M/MV5BMTI2NzU1NTc1NF5BMl5BanBnXkFtZTcwOTQ1MjAwMQ@@._V1_UX67_CR0,0,67,98_AL_.jpg",the magdalen sister,2002,r,114 min,drama,7.7,three young irish women struggl to maintain their spirit while they endur dehuman abus as inmat of a magdalen sister asylum,0.0,peter mullan,eileen walsh,dorothi duffi,nora jane noon,ann mari duff,0.0,4 890 878
"https://m.media-amazon.com/images/M/MV5BMTI0MTg4NzI3M15BMl5BanBnXkFtZTcwOTE0MTUyMQ@@._V1_UY98_CR0,0,67,98_AL_.jpg",good bye lenin,2003,r,121 min,comedi drama romanc,7.7,in 1990 to protect hi fragil mother from a fatal shock after a long coma a young man must keep her from learn that her belov nation of east germani as she knew it ha disappear,0.0,wolfgang becker,daniel br hl,katrin sa,chulpan khamatova,florian luka,0.0,4 064 200
"https://m.media-amazon.com/images/M/MV5BOGY1YmUzN2MtNDQ3NC00Nzc4LWI5M2EtYzUwMGQ4NWM4NjE1XkEyXkFqcGdeQXVyMTQxNzMzNDI@._V1_UY98_CR0,0,67,98_AL_.jpg",in america,2002,pg 13,105 min,drama,7.7,a famili of irish immigr adjust to life on the mean street of hell s kitchen while also griev the death of a child,0.0,jim sheridan,paddi considin,samantha morton,djimon hounsou,sarah bolger,0.0,15 539 266
"https://m.media-amazon.com/images/M/MV5BYzEyNzc0NjctZjJiZC00MWI1LWJlOTMtYWZkZDAzNzQ0ZDNkXkEyXkFqcGdeQXVyMTQxNzMzNDI@._V1_UX67_CR0,0,67,98_AL_.jpg",i am sam,2001,pg 13,132 min,drama,7.7,a mental handicap man fight for custodi of hi 7 year old daughter and in the process teach hi cold heart lawyer the valu of love and famili,0.0,jessi nelson,sean penn,michel pfeiffer,dakota fan,diann wiest,0.0,40 311 852
"https://m.media-amazon.com/images/M/MV5BZjIwZWU0ZDItNzBlNS00MDIwLWFlZjctZTJjODdjZWYxNzczL2ltYWdlXkEyXkFqcGdeQXVyMTMxODk2OTU@._V1_UX67_CR0,0,67,98_AL_.jpg",adapt,2002,r,115 min,comedi drama,7.7,a lovelorn screenwrit becom desper as he tri and fail to adapt the orchid thief by susan orlean for the screen,0.0,spike jonz,nicola cage,meryl streep,chri cooper,tilda swinton,0.0,22 245 861
"https://m.media-amazon.com/images/M/MV5BYWMwMzQxZjQtODM1YS00YmFiLTk1YjQtNzNiYWY1MDE4NTdiXkEyXkFqcGdeQXVyNDYyMDk5MTU@._V1_UX67_CR0,0,67,98_AL_.jpg",black hawk down,2001,a,144 min,drama histori war,7.7,160 elit u s soldier drop into somalia to captur two top lieuten of a renegad warlord and find themselv in a desper battl with a larg forc of heavili arm somali,0.0,ridley scott,josh hartnett,ewan mcgregor,tom sizemor,eric bana,0.0,108 638 745
"https://m.media-amazon.com/images/M/MV5BNjcxMmQ0MmItYTkzYy00MmUyLTlhOTQtMmJmNjE3MDMwYjdlXkEyXkFqcGdeQXVyNzkwMjQ5NzM@._V1_UX67_CR0,0,67,98_AL_.jpg",road to perdit,2002,a,117 min,crime drama thriller,7.7,a mob enforc s son wit a murder forc him and hi father to take to the road and hi father down a path of redempt and reveng,0.0,sam mend,tom hank,tyler hoechlin,rob maxey,liam aiken,0.0,104 454 762
"https://m.media-amazon.com/images/M/MV5BNThiMDc1YjUtYmE3Zi00MTM1LTkzM2MtNjdlNzQ4ZDlmYjRmXkEyXkFqcGdeQXVyMTQxNzMzNDI@._V1_UY98_CR1,0,67,98_AL_.jpg",da experi,2001,r,120 min,drama thriller,7.7,for two week 20 male particip are hire to play prison and guard in a prison the prison have to follow seemingli mild rule and the guard are told to retain order without use physic violenc,0.0,oliv hirschbiegel,moritz bleibtreu,christian berkel,oliv stokowski,wotan wilk m hring,0.0,141 072
"https://m.media-amazon.com/images/M/MV5BNGY3NWYwNzctNWU5Yi00ZjljLTgyNDgtZjNhZjRlNjc0ZTU1XkEyXkFqcGdeQXVyMTQxNzMzNDI@._V1_UX67_CR0,0,67,98_AL_.jpg",billi elliot,2000,r,110 min,drama music,7.7,a talent young boy becom torn between hi unexpect love of danc and the disintegr of hi famili,0.0,stephen daldri,jami bell,juli walter,jean heywood,jami draven,0.0,21 995 263
"https://m.media-amazon.com/images/M/MV5BZGY5NWUyNDUtZWJhZi00ZjMxLWFmMjMtYmJhZjVkZGZhNWQ4XkEyXkFqcGdeQXVyMTQxNzMzNDI@._V1_UX67_CR0,0,67,98_AL_.jpg",hedwig and the angri inch,2001,r,95 min,comedi drama music,7.7,a gender queer punk rock singer from east berlin tour the u s with her band as she tell her life stori and follow the former lover band mate who stole her song,0.0,john cameron mitchel,john cameron mitchel,miriam shor,stephen trask,theodor liscinski,0.0,3 029 081
"https://m.media-amazon.com/images/M/MV5BYzVmYzVkMmUtOGRhMi00MTNmLThlMmUtZTljYjlkMjNkMjJkXkEyXkFqcGdeQXVyNDk3NzU2MTQ@._V1_UX67_CR0,0,67,98_AL_.jpg",ocean s eleven,2001,ua,116 min,crime thriller,7.7,danni ocean and hi ten accomplic plan to rob three la vega casino simultan,0.0,steven soderbergh,georg clooney,brad pitt,julia robert,matt damon,0.0,183 417 150
"https://m.media-amazon.com/images/M/MV5BNTIyNThlMjMtMzUyMi00YmEyLTljMmYtMWRhN2Q3ZTllZjA4XkEyXkFqcGdeQXVyMzM4MjM0Nzg@._V1_UY98_CR1,0,67,98_AL_.jpg",vampir hunter d bloodlust,2000,u,103 min,anim action fantasi,7.7,when a girl is abduct by a vampir a legendari bounti hunter is hire to bring her back,0.0,yoshiaki kawajiri,andrew philpot,john rafter lee,pamela adlon,wende lee,0.0,151 086
"https://m.media-amazon.com/images/M/MV5BMjZkOTdmMWItOTkyNy00MDdjLTlhNTQtYzU3MzdhZjA0ZDEyXkEyXkFqcGdeQXVyMTMxODk2OTU@._V1_UX67_CR0,0,67,98_AL_.jpg",o brother where art thou,2000,u,107 min,adventur comedi crime,7.7,in the deep south dure the 1930 three escap convict search for hidden treasur while a relentless lawman pursu them,0.0,joel coen,ethan coen,georg clooney,john turturro,tim blake nelson,0.0,45 512 588
"https://m.media-amazon.com/images/M/MV5BZDYwYzlhOTAtNDAwMC00ZTBhLWI4M2QtMTA1NmJhYTdiNTkxXkEyXkFqcGdeQXVyNTM0NTU5Mg@@._V1_UX67_CR0,0,67,98_AL_.jpg",interst 60 episod of the road,2002,r,116 min,adventur comedi drama,7.7,neal oliv a veri confus young man and an artist take a journey of a lifetim on a highway i60 that doesn t exist on ani of the map go to the place he never even heard of search for an answer and hi dreamgirl,0.0,bob gale,jame marsden,gari oldman,kurt russel,matthew edison,0.0,Unknown
"https://m.media-amazon.com/images/M/MV5BOGE0ZWI0YzAtY2NkZi00YjkyLWIzYWEtNTJmMzJjODllNjdjXkEyXkFqcGdeQXVyMTQxNzMzNDI@._V1_UX67_CR0,0,67,98_AL_.jpg",south park bigger longer uncut,1999,a,81 min,anim comedi fantasi,7.7,when stan marsh and hi friend go see an r rate movi they start curs and their parent think that canada is to blame,0.0,trey parker,trey parker,matt stone,mari kay bergman,isaac hay,0.0,52 037 603
"https://m.media-amazon.com/images/M/MV5BOTA5MzQ3MzI1NV5BMl5BanBnXkFtZTgwNTcxNTYxMTE@._V1_UX67_CR0,0,67,98_AL_.jpg",offic space,1999,r,89 min,comedi,7.7,three compani worker who hate their job decid to rebel against their greedi boss,0.0,mike judg,ron livingston,jennif aniston,david herman,ajay naidu,0.0,10 824 921
"https://m.media-amazon.com/images/M/MV5BM2FlNzE0ZmUtMmVkZS00MWQ3LWE4OWQtYjQwZjdhNzRmNWE2XkEyXkFqcGdeQXVyMTAwMzUyOTc@._V1_UX67_CR0,0,67,98_AL_.jpg",happi,1998,Unknown,134 min,comedi drama,7.7,the live of sever individu intertwin as they go about their live in their own uniqu way engag in act societi as a whole might find disturb in a desper search for human connect,0.0,todd solondz,jane adam,jon lovitz,philip seymour hoffman,dylan baker,0.0,2 807 390
"https://m.media-amazon.com/images/M/MV5BMDZkMTUxYWEtMDY5NS00ZTA5LTg3MTItNTlkZWE1YWRjYjMwL2ltYWdlL2ltYWdlXkEyXkFqcGdeQXVyMTQxNzMzNDI@._V1_UX67_CR0,0,67,98_AL_.jpg",train day,2001,a,122 min,crime drama thriller,7.7,a rooki cop spend hi first day as a lo angel narcot offic with a rogu detect who isn t what he appear to be,0.0,antoin fuqua,denzel washington,ethan hawk,scott glenn,tom bereng,0.0,76 631 907
"https://m.media-amazon.com/images/M/MV5BMjE2OTc3OTk2M15BMl5BanBnXkFtZTgwMjg2NjIyMDE@._V1_UX67_CR0,0,67,98_AL_.jpg",rushmor,1998,ua,93 min,comedi drama romanc,7.7,the extracurricular king of rushmor preparatori school is put on academ probat,0.0,we anderson,jason schwartzman,bill murray,olivia william,seymour cassel,0.0,17 105 219
"https://m.media-amazon.com/images/M/MV5BYjA2MTA1MjUtYmUyNy00NGZiLTk2NTAtMDk3N2M3YmMwOTc1XkEyXkFqcGdeQXVyMjA0MzYwMDY@._V1_UY98_CR0,0,67,98_AL_.jpg",abr lo ojo,1997,u,119 min,drama mysteri sci fi,7.7,a veri handsom man find the love of hi life but he suffer an accid and need to have hi face rebuilt by surgeri after it is sever disfigur,0.0,alejandro amen bar,eduardo noriega,pen lope cruz,chete lera,fele mart nez,0.0,368 234
"https://m.media-amazon.com/images/M/MV5BYmUxY2MyOTQtYjRlMi00ZWEwLTkzODctZDMxNDcyNTFhYjNjXkEyXkFqcGdeQXVyNDk3NzU2MTQ@._V1_UY98_CR1,0,67,98_AL_.jpg",be john malkovich,1999,r,113 min,comedi drama fantasi,7.7,a puppet discov a portal that lead liter into the head of movi star john malkovich,0.0,spike jonz,john cusack,cameron diaz,catherin keener,john malkovich,0.0,22 858 926
"https://m.media-amazon.com/images/M/MV5BNWMxZTgzMWEtMTU0Zi00NDc5LWFkZjctMzUxNDIyNzZiMmNjXkEyXkFqcGdeQXVyMTQxNzMzNDI@._V1_UX67_CR0,0,67,98_AL_.jpg",as good as it get,1997,a,139 min,comedi drama romanc,7.7,a singl mother and waitress a misanthrop author and a gay artist form an unlik friendship after the artist is assault in a robberi,0.0,jame l brook,jack nicholson,helen hunt,greg kinnear,cuba good jr,0.0,148 478 011
